valoracion,comentario,fecha,valoracion_number,score,day,month,month_string,year
Valoraci칩n: 3 estrellas de cinco,"Google tenemos un problema, con las 칰ltimas actualizaciones han ocurrido muchos errores como por ejemplo: aveces que me quiere cargar un anuncio no lo carga y el video sigue, pero con la pesta침a que dice ""toque para saltar anuncio"" otra cosa es que cuando carga un anuncio se queda congelado y no puedo hacer nada y tengo que quitar el video y ponerlo otra vez.",17 de noviembre de 2022,3,0.6,17,10,noviembre,2022
Valoraci칩n: 1 estrellas de cinco,La cantidad de anuncios se multiplicado tanto que ya no posible usarlo con tranquilidad mientras se realiza otra tarea. Si alg칰n programador est치 leyendo esto: Es un buen momento para que aparezca la alternativa a este software.,19 de diciembre de 2022,1,0.2,19,11,diciembre,2022
Valoraci칩n: 3 estrellas de cinco,"No me gusta mucho la app porque no se puede escuchar m칰sica con la pantalla del celular apagada, tiene muchos anuncios, en los M/V de k-pop bajan muchas vistas (o tambi칠n se pegan) y eso es ""injusto"" porque tambi칠n nos esforzamos para poder llegar a la meta de reproducciones en 24hrs y est치s se detienen casi todo el tiempo o cada 1hora.",4 de diciembre de 2022,3,0.6,4,11,diciembre,2022
Valoraci칩n: 4 estrellas de cinco,"Est치 incre칤ble, es una app para entretenerte para cuando est칠s aburrido, pero 칰ltimamente me a estado ocurriendo un error de que la pantalla del v칤deo se pone negro, y forzosamente tengo que reiniciar la app, arreglen eso porfavor.",14 de diciembre de 2022,4,0.8,14,11,diciembre,2022
Valoraci칩n: 3 estrellas de cinco,"Hola 칰ltimamente estoy teniendo 2 Bugs uno tiene que ver qu칠 la pantalla del v칤deo se distorsiona y otra con que se me traba el v칤deo y cuando se me traba uno se traban todos ya no puedo entrar por qu칠 se bugea bien feo adem치s tengo que reiniciar mi dispositivo para ver videos por eso y ni siquiera es el wifi Porque mis otras redes si funcionan menos Youtube la cual se traba much칤simo, espero lo puedan arreglar",4 de diciembre de 2022,3,0.6,4,11,diciembre,2022
Valoraci칩n: 2 estrellas de cinco,"Un desastre. No funciona la traducci칩n autom치tica: Siempre he vistos videos en otros idiomas y he activado desde la app del tel칠fono o la Pc los subtitulos generados automaticamente. Pero hoy activo la traducci칩n autom치tica, lo pongo para que traduzca del Ingl칠s al espa침ol pero no aparecen los subtitulos. Le doy a idioma original y s칤 aparecen. Estuve viendo en ""Ayuda de You Tube"" y hay muchos con el mismo problema.",13 de diciembre de 2022,2,0.4,13,11,diciembre,2022
Valoraci칩n: 1 estrellas de cinco,"Desde hace unas semanas he estado viendo muchas recomendaciones de videos que yo ya he visto o que no veo; no busco; no me gustan o que se subieron hace 6 a침os o m치s. Por m치s veces que hago click en ""no me interesa"" o ""no recomendar canal"" siguen apareciendo (y a veces me aparecen dos o m치s veces el mismo video con los problemas ya mencionados). Y tambi칠n tengo un problema con los ""shorts"", teniendo la mayor칤a de problemas ya mencionados. Y las nuevas actualizaciones solo lo empeoran.",21 de noviembre de 2022,1,0.2,21,10,noviembre,2022
Valoraci칩n: 1 estrellas de cinco,"Desde hace unos d칤as cuando abro los videos la pantalla se pone en negro y aunque el v칤deo se este reproduciendo no hay audio. Pens칠 que era a la 칰nica que le pasaba, pero me doy cuenta de que no. Este es un error sumamente molesto, ya ni puedo ver videos por qu칠 o no cargan o la pantalla se pone en negro. Aunque lo arreglen mi puntuaci칩n quedar치 como est치 ahora.",21 de noviembre de 2022,1,0.2,21,10,noviembre,2022
Valoraci칩n: 3 estrellas de cinco,"Buena aplicaci칩n, mal funcionamiento, 칰ltimamente la aplicaci칩n me a estado fallando en la reproducci칩n de videos y sobre todo de shorts, algunas veces el v칤deo que estoy viendo se llena como tipo distorsi칩n (como si una tele se estrallara) evitando que me deje ver el v칤deo, en los shorts ocurre esto de manera m치s frecuente, m치s aparte de eso en los shorts los v칤deos se traban algunas veces y vuelven a repetir una y otra vez una misma parte del short, ojal치 esto tenga soluci칩n en un futuro.",18 de octubre de 2022,3,0.6,18,9,octubre,2022
Valoraci칩n: 3 estrellas de cinco,"La aplicaci칩n es muy buena en general la ocupo m치s que mis redes sociales y nunca he tenido alg칰n problema con los videos o que se crashen, sin embargo creo que la cantidad de anuncios que ponen es un poco excesiva y se torna un poco tedioso que cada video tenga 2 anuncios al inicio y no solo eso sino que a veces los ponen a la mitad de los videos y es muy complicado escuchar m칰sica o videos de asmr tranquilamente b치sicamente te obliga a pagar la premiun",6 de octubre de 2022,3,0.6,6,9,octubre,2022
Valoraci칩n: 1 estrellas de cinco,"Tengo Spotify premium, no es mi intenci칩n pagar otra suscripci칩n para no tener comenciales. Youtube esta teniendo un mont칩n de comerciales, es absurda la cantidad. Es una lastima, prefiero usar otras plataformas antes que pagar membres칤a. En fin.",30 de noviembre de 2022,1,0.2,30,10,noviembre,2022
Valoraci칩n: 2 estrellas de cinco,"La aplicaci칩n funciona bien y los videos se ven correctamente, creo que falta que los videos puedan escucharse en audio 5.1, pero lo m치s importante es que hace mucha falta una opci칩n de RELACION ASPECTO (Aspect Ratio) hay celulares en donde poniendo la opci칩n zoom se ven los videos en pantalla completa, pero se cortan muchos bordes del v칤deo, lo mejor ser칤a una opci칩n relaci칩n aspecto para que el usuario acomode el v칤deo de acuerdo a lo que est치 usando.",27 de octubre de 2022,2,0.4,27,9,octubre,2022
Valoraci칩n: 5 estrellas de cinco,"Es una buena aplicaci칩n, pero el problema es que a cada rato te salen anuncios, y adem치s deber칤an solucionar definitivamente el error de pantalla, ya que sale de color verde, azul, o se bugea o glichea el video, ya que a cada rato hay que borrar el cache y adem치s no me deja ver mis videos a veces se traban me gustar칤a que lo sulucionen",2 de octubre de 2022,5,1.0,2,9,octubre,2022
Valoraci칩n: 1 estrellas de cinco,"De mal en peor, se que los anuncios llegaron para quedarse, pero, ahora se pausan y hay de poner play para seguir viendo el otro anuncio o el v칤deo, y no siempre te agarra el play y hay que poner otro video para a fin de poder seguir disfrutando de la app; adem치s, de que al girar el tel칠fono ya no se activa la pantalla completa, lo hace cuando quiere.",15 de noviembre de 2022,1,0.2,15,10,noviembre,2022
Valoraci칩n: 3 estrellas de cinco,"Hay algo que me molesta demasiado,. Y es colocar una foto de perfil, son demasiado estrictos y es molesto tener que colocar una foto exactamente del mismo tama침o que lo piden, puse todas las fotos de mi galer칤a y ninguna me las aceptaba, y de verdad no se que foto poner, y suena algo estupid0, pero para mi canal no lo es.",19 de diciembre de 2022,3,0.6,19,11,diciembre,2022
Valoraci칩n: 2 estrellas de cinco,Anuncios molestos que solo interumpen a la hora de reproducir la m칰sica o alg칰n v칤deo. Otro caso son los subt칤tulos que a칰n no est치n para todos los v칤deos que ofrece algo molesto pero puede mejorar.,18 de diciembre de 2022,2,0.4,18,11,diciembre,2022
Valoraci칩n: 1 estrellas de cinco,"Tengo problemas con la app hace unas 3 actualizaciones, al ver un v칤deo y cambiar de app, luego la calidad de los videos se baja y no permite cambiarla, y se debe reiniciar la app cada vez que pasa",8 de diciembre de 2022,1,0.2,8,11,diciembre,2022
Valoraci칩n: 2 estrellas de cinco,"Esta ocurriendo un error y es que los videos me cargan la mitad de veces en negro, no se ve nada, las miniaturas si salen y todo lo demas pero al reproducir el video esta en negro completamente solo se escucha el audio",8 de diciembre de 2022,2,0.4,8,11,diciembre,2022
Valoraci칩n: 5 estrellas de cinco,"Pagando Youtube Premium, de lo mejor que existe! Entiendo que sin el Premium nada m치s que son anuncios, no puedes usarlo en segundo plano entre otras cosas, no tienes funciones exclusivas... Pero con el Premium vale la pena cada centimo y encima a침ades Youtube Music. Ojal치 todo esto fuera totalmente gratis pero la moda de pagar a plazos ha llegado para quedarse, sinceramente lo pago por el Music pero a침ade todas las funciones en Youtube y de verdad que si no suben el precio merece la pena.",18 de noviembre de 2022,5,1.0,18,10,noviembre,2022
Valoraci칩n: 1 estrellas de cinco,"춰Devuelvanme la antigua versi칩n! No puedo ver ni un video de cinco minutos sin que se trabe, y no por los anuncios. As칤 como metieron una actualizaci칩n sin preguntar (que yo lo ten칤a desactivado, supuestamente), metan otra para regresarlo a la normalidad. Ni hablar de Youtube en los smarts y en los chromecast. Funcionan del horror.",26 de octubre de 2022,1,0.2,26,9,octubre,2022
Valoraci칩n: 1 estrellas de cinco,"Hace dos meses todo estaba perfecto, pero la 칰ltima actualizaci칩n quit칩 la opci칩n de traducci칩n autom치tica, que para m칤 era lo mejor porque as칤 pod칤a ver cualquier v칤deo no importaba en que idioma estaba ...LA ULTIMA ACTUALIZACI칍N NO FUUE BUENA",11 de diciembre de 2022,1,0.2,11,11,diciembre,2022
Valoraci칩n: 1 estrellas de cinco,"Ya es imposible ver un video, y mucho peor, escuchar una playlist sin que te metan 3 anuncios y sin poderlos omitir. Y no, no voy a pagar una mensualidad de una aplicacion por ver videos tranquilamente, cuando antes se podia con normalidad. Hasta este punto, Youtube prefiere llenarse los bolsillos de dinero que ofrecerle un buen servicio a su visualizadores.",30 de noviembre de 2022,1,0.2,30,10,noviembre,2022
Valoraci칩n: 4 estrellas de cinco,"Una app muy buena, realmente entretenida. Aunque uno de los fallos que mas me molestan es que a la hora de subir un video, en varias ocasiones la descripci칩n no se guardo y haga que el video se suba sin titulo ni nada. Es algo realmente molesto, me seria de mucho agrado que lo arreglaran, de no ser por eso se llevaba 5 estrellas",5 de diciembre de 2022,4,0.8,5,11,diciembre,2022
Valoraci칩n: 2 estrellas de cinco,"Gracias a la nueva actualizaci칩n, los subt칤tulos tardan en aparecer y reci칠n aparecen a lo 칰ltimo cuando se termina el v칤deo y m치s si es en ingl칠s o en cualquier idioma, realmente espero que arreglen ese error por favor...",12 de diciembre de 2022,2,0.4,12,11,diciembre,2022
Valoraci칩n: 1 estrellas de cinco,"Y de que sirven las opiniones si de todos modos hacen lo que quieren, meten sus malditos anuncios, dicen que es para ayude a la ap, pero m치s bien para que ayude a su bolsillo, por que, que yo me acuerde antes no hab칤a anuncios y tambi칠n funcionaba y mejor... claro!! Lo hacen para que descargues la de paga...aparte de que en mi tablet no me acepta ning칰n Youtube",18 de diciembre de 2022,1,0.2,18,11,diciembre,2022
Valoraci칩n: 4 estrellas de cinco,"Obvio, la app es buena... Pero desafortunadamente tengo un problema con la pesta침a ""Comentarios"" de los v칤deos, cada vez que escribo en el modo oscuro la letras pasan de un color blanco a un color negro, que hace que las letras sean imposibles de leer, y uno no sabe que cosa est치 uno escribiendo. S칩lo es un detalle, pero que de todos modos molesta. Mi equipo es un Xiaomi Redmi 9. Adi칩s.",8 de diciembre de 2022,4,0.8,8,11,diciembre,2022
Valoraci칩n: 1 estrellas de cinco,"Por cada actualizacion anda peor, meten demasiados anuncios, la lista de reproduccion funciona como el orto,los videos si los reproducis a una calidad de 1080p se traba todo,(cosa que no pasaba antes y no es por problema de wifi) no rota la pantalla para el lado que uno quiere, han hecho pura estupides con agregar estas boludeces de shorts, al igual de que si uno quiere ver un video viejo de un canal, desahbilitaron ver desde mas viejo a mas nuevo asi que tenes que bajar todo como un forro",28 de octubre de 2022,1,0.2,28,9,octubre,2022
Valoraci칩n: 1 estrellas de cinco,"* Cada vez los anuncios son m치s molestos * La app ha presentado reiteradas detenciones en d칩nde tengo que cerrarla y volver a iniciarla, no siendo problema de se침al. * Que muestre los ""No me gusta"" * Bajan videos educativos de pol칤tica y salud (que no apoyen al progresismo y la agenda 2030), pero permiten videos fake de ciencia y salud, as칤 como empresas de estafa piramidal 游땨",17 de diciembre de 2022,1,0.2,17,11,diciembre,2022
Valoraci칩n: 1 estrellas de cinco,"Con la 칰ltima actualizaci칩n la rotaci칩n autom치tica no funciona bien, cuando giras el movil no se gira para hacer pantalla completa, debes de picarle en el boton para que se volte칠. Y si, es YT porque probe con la Galer칤a del telefono y otras apps y funciona correctamente. Todo esto pasa en un Galaxy S22 Ultra con Android 12.",3 de noviembre de 2022,1,0.2,3,10,noviembre,2022
Valoraci칩n: 5 estrellas de cinco,"es una muy buena app para ver pel칤culas y disfrutar de tus videos favoritos; al igual que mantenernos informados de cualquier accidente de tr치nsito,nos informa del clima, tambi칠n de contenidos educativos,que como se encuentra el mundo,sobre los deportes,saber m치s curiosidades de tus pel칤culas favoritas, etc.......es una verdadera experiencia al tener esta aplicaci칩n para haci mantenernos entretenidos......(pero cuidado en ocasiones esta aplicaci칩n es utilizada para el mal de personas malvadas)",29 de octubre de 2022,5,1.0,29,9,octubre,2022
Valoraci칩n: 3 estrellas de cinco,"Es muy buena esta app,pero 칰ltimamente,desde las recientes actualizaciones cada que voy a buscar contenido por el micro de la app,la app simplemente se cierra,y esto ocurre muy seguido,tanto que intento hasta 5 veces y la app se cierra. Espero que solucionen este peque침o problema,ya que es muy molestoso para los que no podemos escribir lo que buscamos y tenemos que recurrir al micro,por favor arreglen esto. De resto la app es perfecta游녧游낕 GRACIAS.",9 de diciembre de 2022,3,0.6,9,11,diciembre,2022
Valoraci칩n: 2 estrellas de cinco,"Con la 칰ltima actualizaci칩n, no s칠 qu칠 han tocado, pero a veces entras en un video y este se ve en negro solo reproduciendo el audio, tienes que salir de la app para que se arregle.",19 de diciembre de 2022,2,0.4,19,11,diciembre,2022
Valoraci칩n: 1 estrellas de cinco,"Los anuncios son cada vez m치s invasivos, con anuncios de m치s de 3 minutos. Quitaron funciones fundamentales. Ya no se puede retroceder una transmisi칩n en vivo, lo cu치l es de vital importancia. Por favor, vuelvan a habilitar esta funcionalidad, mientras tanto les coloco UNA estrella.",9 de diciembre de 2022,1,0.2,9,11,diciembre,2022
Valoraci칩n: 3 estrellas de cinco,"mejorable y excesivamente caro de pagar con el detalle de que ha de ser en formato de suscripci칩n y no de otras formas m치s c칩modas y para finalizar mi cr칤tica: las formas de pago son pocas y en la actualidad, existen millones de personas utilizando las crypto-monedas como m칠todo de pago o de intercambio (dato a tener en cuenta, por favor).",20 de diciembre de 2022,3,0.6,20,11,diciembre,2022
Valoraci칩n: 2 estrellas de cinco,"La aplicaci칩n tiene muchos anuncios cuando pongo un v칤deo siempre pero siempre hay un anuncio en el inicio encima que algunas veces se traba los videos y algo que no importa mucho pero es que antes en el historial se pod칤a ver todos los videos que vistes pero ahora en la 칰ltima actualizaci칩n solo puedes ver lo que viste ayer y hoy y cuando lo buscas en el historial muchas veces no aparece y no veo necesidad de actualizar el historial creo que muchas personas no lo usan, las actu. nuevas no me gu",20 de noviembre de 2022,2,0.4,20,10,noviembre,2022
Valoraci칩n: 1 estrellas de cinco,"La nueva actualizaci칩n algunas veces falla el giro autom치tico de la pantalla,cuando lo quieres poner apaisado o en vista horizontal.Sigue el problema de los subtitulos que se ponen solos aunque los desactives,sigue fallando mucho en la traducci칩n,que a 칠stas alturas y a침os,ya tendr칤a que estar solucionado.Si lo env칤as v칤a Google Chrome a una tv, no salgo como usuario y no te deja iniciar sesi칩n en YouTube. En el m칩vil y la app de YouTube si estoy como usuario,luego en la tv no. Saludos",3 de noviembre de 2022,1,0.2,3,10,noviembre,2022
Valoraci칩n: 1 estrellas de cinco,"Casi no hab칤a visto anuncios en esta aplicaci칩n, pero acabo de actualizarla y me encuentro que ahora est치 plagada de ellos. Anuncios por todos lados. Adem치s, cuando estoy viendo un video, est칠 se para por un momento pero el audio sigue, entonces se descincroniza el audio del video. Es realmente molesto.",7 de diciembre de 2022,1,0.2,7,11,diciembre,2022
Valoraci칩n: 1 estrellas de cinco,Las 칰ltimas actualizaciones se han cargado la calidad de la aplicaci칩n. La calidad de imagen siempre al m칤nimo. Lo cual encuentro sin sentido si estoy viendo un v칤deo. Quiero ver lo que hay no figuras. A esto se le suma la Publicidad excesiva. Estar viendo un v칤deo y que se pare 4 veces para poner el anuncio de turno... Cada vez encuentro un peor servicio.,1 de noviembre de 2022,1,0.2,1,10,noviembre,2022
Valoraci칩n: 4 estrellas de cinco,"YouTube es genial, solo que tiene algunos problemas que le quitan lo genial, los anuncios se mezclan con las im치genes del video, el audio a veces no coincide con el v칤deo, y en ocasiones la pantalla se queda trabada, espero que lo arreglen para que sea m치s genial , me encanta la nueva interfaz, punto +1",21 de noviembre de 2022,4,0.8,21,10,noviembre,2022
Valoraci칩n: 1 estrellas de cinco,"Es incre칤ble que ahora luego de actualizar esa basura de app que esta repleta de publicidad invasiva y errores tras errores ahora resulta que lw pusieron l칤mite a la cantidad de videos que se pueden guardar!! Hay que ser tarados para limitar esa funci칩n y no simplificar el sector de videos guardados, que carajos piensan estos in칰tiles desarrolladores??? Que vamis a estar seleccionando video 1x1 para eliminar?? Agreguen una barra de desplazamiento al menos!!!! Tarados!!!!",10 de noviembre de 2022,1,0.2,10,10,noviembre,2022
Valoraci칩n: 1 estrellas de cinco,"Les pongo una estrella porque no se puede poner cero, pero cada vez m치s ponen m치s anuncios a칰n cuando se est치 escuchando un video de relajaci칩n, a media relajaci칩n ponen un anuncio, es demasiado. Ya ni las noticias se pueden ver en paz. Odio cuando ponen m치s y m치s anuncios. Por eso Spotify es cada vez mejor. Prefiero pagar Spotify.",11 de diciembre de 2022,1,0.2,11,11,diciembre,2022
Valoraci칩n: 1 estrellas de cinco,"Hacen premium un servicio que deber칤a ser gratuito, hay m치s anuncios que nada, siempre dejan mucho que desear. Quitando el bot칩n de dislike simplemente demuestran su incompetencia. Me sorprende la cantidad de anuncios que pueden poner en v칤deos de 10 minutos, o incluso en los de una hora, casi podr칤a asegurar que llegan a los 10 o 5 minutos de anuncios",12 de noviembre de 2022,1,0.2,12,10,noviembre,2022
Valoraci칩n: 1 estrellas de cinco,"Tengo un Redmi Note 9 y de repente la aplicaci칩n deja de funcionar, tengo que cerrar la aplicaci칩n y volver a abrirla para que funcione, lo cual es bastante frustrante porque sucede al rededor de dos veces cada treinta minutos. S칠 que es un problema de la aplicaci칩n porque mi tel칠fono no est치 fallando con ninguna otra. Por favor reparen este problema, antes la aplicaci칩n funcionaba bien.",24 de noviembre de 2022,1,0.2,24,10,noviembre,2022
Valoraci칩n: 5 estrellas de cinco,"Muy bien la aplicacion se actualiza segun las tendencias como los short, lo que si me di cuenta que ya no funciona en segundo plano la opcion de video (opcion miniatura) para mi era util ya que podia siguir viendo el video miestras chequeaba otras cosas en mi celular (s10)",18 de diciembre de 2022,5,1.0,18,11,diciembre,2022
Valoraci칩n: 4 estrellas de cinco,"Youtube es una de las apps de video principales,y dire algo ya que en primer lugar la version de noviembre ha tenido algunos errores en algunos dispositivos,como que la pantalla se ponga en verde pixeleado o errores de audio en algunos v칤deos. Deber칤an solucionar lo primordial en esta app ya que es muy 칰til y entretenida 游땏",7 de diciembre de 2022,4,0.8,7,11,diciembre,2022
Valoraci칩n: 3 estrellas de cinco,"Est치 mal que no se puedan descargar los videos gratis.. esto ya es el colmo como descargar cuesta dinero? No se si soy al unico que le pasa pero los videos salen en negro aveces, y los anuncios minimo salen 2 antes de el video solo pido que descagar sea gratis",16 de diciembre de 2022,3,0.6,16,11,diciembre,2022
Valoraci칩n: 3 estrellas de cinco,"Es una buena app, perfecta para ver v칤deos. Pero es tambi칠n mala por los anuncios. Demasiados hay, y adem치s la mayor칤a no se quitan. Esque por ver un video de 30 segundos y hay 2 anuncios (que no se pueden saltar) de cada uno 30 segundos, es m치s de lo que veo. Tambi칠n hay ni침os que YouTube les recomienda cosas.. Digamos inapropiadas, lo cual no me parece bien xq les arruina la infancia. Es buena, la recomiendo, pero cuidadito con eso, pls arreglarlo. Atentos, no digo que no me guste, me gusta",19 de noviembre de 2022,3,0.6,19,10,noviembre,2022
Valoraci칩n: 1 estrellas de cinco,"Si la aplicaci칩n y su inteligencia artificial reconocen que los v칤deos son infantiles, por qu칠 ponen publicidad de videos musicales que no podr칤an ser para ni침os? Si tambi칠n reconocen el idioma porque la publicidad es de idioma distinto? Algo intuitivo es que no pongan reggaeton 치rabe que ve mi hijo. Por eso a veces prefiero poner prime o Netflix",13 de diciembre de 2022,1,0.2,13,11,diciembre,2022
Valoraci칩n: 5 estrellas de cinco,"Esta muy buena la aplicaci칩n, me gusta y me agradan las nuevas actualizaciones con fondos de colores para los canales, la sincronizaci칩n de los colores del v칤deo al fondo de lo dem치s, lo 칰nico malo esque a veces hay muchos anuncios, m치s sin embargo de ah칤 en fuera, todo est치 bien con la aplicaci칩n.",23 de octubre de 2022,5,1.0,23,9,octubre,2022
Valoraci칩n: 2 estrellas de cinco,"Con la 칰ltima actualizaci칩n falla much칤simo la app, m치s que nada con el tema de los anuncios ya que estos aparecen pero cuando terminan se traba la app, tengo que quitar un v칤deo y volverlo a poner para que se reproduzca o de plano cerrar la app y volverla a abrir por qu칠 se bugea, adem치s de que la reproducci칩n autom치tica funciona cuando quiere",16 de noviembre de 2022,2,0.4,16,10,noviembre,2022
Valoraci칩n: 3 estrellas de cinco,"Se salva por poco: desde la ultima actualizaci칩n ha mejorado un poco el rendimiento, pero sigue siendo insuficiente. Se sigue sin estar la opci칩n de ordenar v칤deos de creadores de contenido de mas antiguos a nuevos y se han a침adido desmejoras (recomendaciones fuera de lugar). Sigue siendo cansino, ser m치s conscientes con estos desastres y pedir a los usuarios opiniones sinceras y constructivas. Sobre los anuncios... lo de siempre; abusivos, molestos, cargan mejor que los v칤deos... nada nuevo...",29 de octubre de 2022,3,0.6,29,9,octubre,2022
Valoraci칩n: 3 estrellas de cinco,"Porque quitaron la opcion de ver videos m치s antiguos hasta los mas recientes. Antes cuando buscaba videos en canales me aparecia esa opcion pero ahora solo est치 la de ""ver videos mas populares"" y la de ""subidos recientemente"" agradeceria que regresaran esa opci칩n que mencion칠 al principio. Eso facilitaba la forma de buscar videos y no tener que bajar toda una lista inmensa de videos para ver el primero de algun canal.",11 de noviembre de 2022,3,0.6,11,10,noviembre,2022
Valoraci칩n: 1 estrellas de cinco,Ya no es tan buena pongo un v칤deo y me saltan anuncios hasta 9 veces he tenido que salir del v칤deo y volver por qu칠 sal칤a y entraba y segu칤a coloc치ndome anuncios as칤 9 veces del tir칩n . Estan en un plan como diciendo o te comes los anuncios o no ves el v칤deo.,14 de diciembre de 2022,1,0.2,14,11,diciembre,2022
Valoraci칩n: 1 estrellas de cinco,"Los anuncios. Simplemente los anuncios arruinan todo, antes se entend칤a, eran anuncios los cuales duraban 5 segundos o se pod칤an saltar en los 5 segundos, o aveces solo hab칤a un anuncio de 15 segundos y ya no aparec칤an en un buen rato, Acabo de toparme con 2 ANUNCIOS DE 10 SEGUNDOS LOS CUALES NO SE POD칈AN SALTAR, En resumen, Los anuncios arruinan completamente MI Experiencia con You tube, Podr치n decir ""Son cortos anuncios"" pero eso cambia, ya que al ver canciones de 3 min, Los anuncios la cagan.",13 de diciembre de 2022,1,0.2,13,11,diciembre,2022
Valoraci칩n: 2 estrellas de cinco,"Desde que lo actualize a la 칰ltima versi칩n cada ves que intento reproducir un video sale la pantalla completamente en negro y solo se escucha el audio, ojal치 y lo solucionen y de hay recien le dar칠 5 estrellas",18 de diciembre de 2022,2,0.4,18,11,diciembre,2022
Valoraci칩n: 3 estrellas de cinco,"Es una de las dos redes sociales que uso de forma diaria. Tiene much칤simo contenido 칰til. Sin embargo, es una l치stima que hayan quitado el bot칩n de ""no me gusta"", y que implemen los shorts sin tener una opci칩n para desactivarlos. A m칤, como a algunos otros, por varios motivos, no nos gustan, y me parece molesto estar obligado a tener el panel de shorts en el feed.",29 de noviembre de 2022,3,0.6,29,10,noviembre,2022
