valoracion,comentario,fecha,valoracion_number,score,day,month,month_string,year
Valoraci칩n: 4 estrellas de cinco,"Buena app... (Sin embargo, esta app 칰ltimamente ha mostrado anuncios inapropiados e inescrupulosos, especialmente de apps ilegales, lo peor ocurre antes, durante y despu칠s del v칤deo donde los ponen a prop칩sito con el fin de no dejar ver el v칤deo al que utiliza YouTube, era mejor tiempo atr치s donde lo pon칤an sin necesidad de interrumpir el v칤deo, abajito junto a la barra de reproducci칩n del v칤deo. Deben reparar eso y regular el tema de esos anuncios ileg칤timos en la app)",14 de diciembre de 2022,4,0.8,14,11,diciembre,2022
Valoraci칩n: 4 estrellas de cinco,"La verdad la App es buena como todas, lo de los anuncios lo entiendo por que as칤 es como mantienen la aplicaci칩n a flote promocionando marcas etc, pero las 칰ltimas actualizaciones no ayudan en nada en vez de mejorar agregan m치s problemas, por ejemplo las dos flechas que aparecen al reproducir un video y no deja ver por completo y no se pueden quitar por favor solucionen eso y otras cosas si... Gracias",4 de octubre de 2022,4,0.8,4,9,octubre,2022
Valoraci칩n: 1 estrellas de cinco,"Se ha vuelto horrible el uso de esta app. La cantidad de anuncios es insoportable, adem치s de esto hay ocasiones en que no puedo deslizar entre los comentarios o las sugerencias del v칤deo en reproducci칩n... Y ahora tambi칠n pasa que, si cambio a otra app (sin cerrar YouTube) y luego vuelvo, el video no gira autom치ticamente al cambiar la orientaci칩n; tengo que cerrar totalmente la app para que vuelva a funcionar la rotaci칩n. Por favor corrijan esto. Gracias.",17 de noviembre de 2022,1,0.2,17,10,noviembre,2022
Valoraci칩n: 1 estrellas de cinco,"De las aplicaciones m치s recurrentes y con peor experiencia a la hora de usar... Tiene bugs puntuales, su abusivo sistema de anuncios, el algoritmo est치 totalmente roto, me aparecen recomendaciones a mont칩 s칩lo porque le d칤 de manera random a un video, y a칰n no arreglan la opci칩n de cambiar la calidad a pesar de las constantes cr칤ticas.",19 de diciembre de 2022,1,0.2,19,11,diciembre,2022
Valoraci칩n: 1 estrellas de cinco,"Cada vez peor... En todos los videos para verlos previamente tienes que esperar a que pasen dos anuncios (m칤nimo) al comienzo y si encima el v칤deo es largo a cada poco hay otro anuncio (antes era cada m치s tiempo). Adem치s si est치s viendo algo en una playlist a cada que cambias o cambia autom치ticamente de v칤deo, vuelven a saltar al menos dos anuncios m치s (sino 3). Al final terminas m치s tiempo viendo anuncios que lo que realmente quieres ver.",14 de diciembre de 2022,1,0.2,14,11,diciembre,2022
Valoraci칩n: 1 estrellas de cinco,"La cantidad de anuncios es absurda, considerando que en la mayor칤a de los casos antes de reproducir el v칤deo lo primero que aparece es un anuncio o doble anuncio. Y en varias ocasiones estos no muestran la opci칩n de saltarlo, directamente debes comerte toda la publicidad que muestran. En un par de ocasiones el anuncio concistia en una entrevista de celebridades la cual duraba nada m치s y nada menos que una hora completa!!! Una cosa es incluir publicidad breve y otra poner casi una pel칤cula.",17 de diciembre de 2022,1,0.2,17,11,diciembre,2022
Valoraci칩n: 1 estrellas de cinco,"Mmm, creo que no soy la 칰nica usuaria que presenta problemas con la nueva actualizaci칩n de YouTube. Ya que cada vez que voy a reproducir un v칤deo, el video sale completamente en negro solo se puede escuchar el audio o en algunos casos no se escucha ni el audio sin contar que no importa que cierre la app sigue teniendo ese mismo problema .... Adem치s sin contar que hacen un spam de anuncios, hay m칤nimo 6 anuncios por video algo muy insoportable, adem치s con los cortos la situaci칩n no cambia mucho.",12 de diciembre de 2022,1,0.2,12,11,diciembre,2022
Valoraci칩n: 1 estrellas de cinco,"QUE HORRO! Los anuncios hacen que la experiencia sea un fastidio. Antes solo aparec칤a un anuncio al finalizar el video. Pero ahora no, cuando empieza el video, durante el video (hay m칤nimo seis) y cuando terminan, no pasan ni dos minutos y otro anuncio aparece, y ni se puede adelantar. Pero claro eso no les importa. Realmente solo hacen que uno migre a otras plataformas.",12 de diciembre de 2022,1,0.2,12,11,diciembre,2022
Valoraci칩n: 1 estrellas de cinco,"Pero que mala experiencia me est치 dejando!! Dejen de actualizarlo tanto as칤 como estaba hace unos meses est치 perfecto, insisten en meterle cosas y cosas que solo hacen que salgan nuevos errores y problemas,ademas de la lentitud que con cada actualizaci칩n se hace m치s evidente, por ejemplo cada que quieres guardar un v칤deo en una de tus listas, tarda mucho en cargar las listas para meterlo, siendo que antes sal칤a al instante, est치 app va directo al fracaso si siguen asi, si no cambian de estrateg",8 de diciembre de 2022,1,0.2,8,11,diciembre,2022
Valoraci칩n: 3 estrellas de cinco,"Tiene algunos errores (como que a veces al terminar un anuncio, el video se mezcla con una imagen intermitente del anuncio o que a veces al poner un video no tiene sonido). Desde que quitaron la funci칩n de enfocar los videos, la app es un desastre. Los videos se ralentizan y no coinciden con el audio. Nunca hab칤a presentado tantos problemas. Es bastante molesto. Con las 칰ltimas actualizaciones van de mal en peor. Hasta parece que van involucionando.",9 de noviembre de 2022,3,0.6,9,10,noviembre,2022
Valoraci칩n: 2 estrellas de cinco,"La verdad no s칠 si es un Bug o una cosa que configure por error, la cosa es que cuando quiero ver los comentarios, NO PUEDO, y no me aparece tampoco los comentarios, eso en mi opini칩n es un poco molesto. Espero revisen mi caso y me den una gu칤a para solucionar el problema. Gracias por su atenci칩n. A y que quiten los MOLESTOS anuncios dobles que no se pueden saltar, gracias.",19 de diciembre de 2022,2,0.4,19,11,diciembre,2022
Valoraci칩n: 1 estrellas de cinco,"Por que sacaron la funci칩n de ir a cualquier parte del video punteando sobre la barra? Literalmete era una de las funciones m치s 칰tiles de la app y la pagina en celulares. Son unos idiotas. Edit: cada vez peor, en las 칰ltimas actualizaciones (11/2022) no se puede compartir videos a un smart tv. Antes detectaba el televisor al instante, ahora ""busca"" dispositivos por un rato y al final no encuentra nada.",9 de noviembre de 2022,1,0.2,9,10,noviembre,2022
Valoraci칩n: 2 estrellas de cinco,"Una excelente aplicaci칩n con gran variedad de contenidos, y sin embargo, estos 칰ltimos a침os ha caido en picada por 2 cosas; el algoritmo y los anuncios. En lo personal, me afecta m치s lo segundo, pues la raz칩n por lo que no veo Tele es por los comerciales, y pues cada vez YouTube agrega m치s anuncios (facilmente 2 en cada video) cada vez m치s largos (al inicio eran de 5 segundos, ahora 15 o m치s) y de tem치ticas que ni siquiera son de interes.",2 de diciembre de 2022,2,0.4,2,11,diciembre,2022
Valoraci칩n: 1 estrellas de cinco,"Es una app muy buena, podemos ver videos , informarnos de noticias o en algunos casos grabar videos . Pero la cantidad de anuncios es EXCESIVA, no se disfruta en absoluto lo buena que es la app por ese peque침o error. Realmente es mucha publicidad. Hasta que deje de aparecer tanta publicidad excesiva ,mi puntuaci칩n de una estrella no va a cambiar.",5 de diciembre de 2022,1,0.2,5,11,diciembre,2022
Valoraci칩n: 1 estrellas de cinco,"칔ltimamente no funciona la b칰squeda por voz ni en YT, ni en YT Music. Adem치s de que la funci칩n reproducci칩n autom치tica, a pesar de tenerla activada, a veces tampoco funciona, reproduce una canci칩n y te quedas colgado esperando a que inicie la otra. Por si fuera poco, hay ocasiones en que la rotaci칩n autom치tica tampoco sirve, tienes que activar el 칤cono de cuadrito para tener vista de pantalla completa aun con el dispositivo en posici칩n horizontal.",11 de noviembre de 2022,1,0.2,11,10,noviembre,2022
Valoraci칩n: 1 estrellas de cinco,"La aplicaci칩n funciona muy bien y casi no tiene errores, adem치s de que me gusta mucho gran cantidad de contenido... Pero detesto sus anuncios, solo me salen anuncios de cr칠ditos y ya estoy harto, ademas que antes pod칤a quitar los anuncios de videos largos, pero ya quitaron ese error y veo que salen anuncios cada 4 minutos!!! Es decir que en un video de 20 minutos m칤nimo me salen 4 anuncios de pr칠stamos. Lo que har칠 ahora es descargar los videos y no les dar칠 el gusto de hacer estad칤sticas de mi",13 de octubre de 2022,1,0.2,13,9,octubre,2022
Valoraci칩n: 3 estrellas de cinco,"Creo que fue un paso equivocado que al pinchar la flechita de minimizar estando en pantalla completa, 칠sta no se gire a posici칩n vertical como antes sino que permanezca rotada 90춿. Tambi칠n a veces los v칤deos se interrumpen con publicidad cada 2 minutos y medio. Es demasiado, procuren espaciarlos un m칤nimo de 7 minutos.",19 de diciembre de 2022,3,0.6,19,11,diciembre,2022
Valoraci칩n: 3 estrellas de cinco,"Estoy HARTO de que cada poco, 칰ltimamente cada d칤a, la app de forma unilateral decide seleccionar la calidad de v칤deo en ""autom치tico"", a pesar de la infinidad de veces que dejo marcadas las opciones de ""mayor calidad de imagen"" tanto con datos m칩viles como con WiFi. Y no tengo seleccionado ning칰n ahorro de datos ni nada. Pues no puede ser. Voy a mirar una app alternativa porque esto es rid칤culo.",25 de octubre de 2022,3,0.6,25,9,octubre,2022
Valoraci칩n: 2 estrellas de cinco,"Siempre anuncios, todo el tiempo. Encima son 2 seguidos y aparecen a cada rato en los videos. En un video de 10 minutos aparecen como 8 anuncios en total. Horrible, antes solo eran 2 o 3 anuncios por video que solo duraban 5 segundos. Ni quiero escribir sobre que es posible que tenga que ver hasta 6 anuncios casi seguidos por adelantar un v칤deo. Tambi칠n sucede, y me molesta demasiado, que cuando termine un anuncio el v칤deo tenga errores y aparezca a la mitad o a veces no se pueda seguir viendo.",17 de noviembre de 2022,2,0.4,17,10,noviembre,2022
Valoraci칩n: 1 estrellas de cinco,"He estado disfrutando mucho de ver videos de cualquier idioma gracias a la generaci칩n autom치tica de subt칤tulos para cualquier idioma, que pusieron en la app hace poco, pero por alguna raz칩n tras actualizar la aplicaci칩n esa funci칩n dejo de servir no importa que v칤deo trate de traducir al activar los subt칤tulos la app no traduce ni una palabra eh intentado traducir videos desde otros dispositivos y simplemente la opci칩n de traducir de forma autom치tica dejo de funcionar por completo.",20 de diciembre de 2022,1,0.2,20,11,diciembre,2022
Valoraci칩n: 1 estrellas de cinco,"Hola buenos d칤as, ultimamente , esta aplicaci칩n no de funcionar bien, hay muchas cosas que andan mal. 1) no me deja ver videos, cuando presiono uno, me aparece y se reproduce, pero se reproduce en negro y sin sonido. He actualizado todo, he hecho de todo, pero esto no se arregla 2) los cortos, aparte de pasarle de vez en cuando lo que puse en el punto 1, estos cuando se los puede ver, se ven o extremadamente borrosos o se tildan y no andan. el internet me anda perfecto, pues es un fallo...",20 de noviembre de 2022,1,0.2,20,10,noviembre,2022
Valoraci칩n: 2 estrellas de cinco,"Tengo un problema con los nuevos precios que cobra YouTube premium de $1 dolar , paso a $5 d칩lares , el pack familiar, pero m칤 molestia es que avisaron con 3 d칤as de antelaci칩n los cambios efectuados , osea 3 d칤as antes de cobrarme el nuevo precio. Me parece muy poco profesional de su parte , esto se avisa con un mes de antelaci칩n , tambi칠n tiene dificultades , c칩mo la traducci칩n autom치tica , en todo caso lo dem치s est치 muy bien . Saludos.",16 de diciembre de 2022,2,0.4,16,11,diciembre,2022
Valoraci칩n: 1 estrellas de cinco,"Utilizo mucho la app, y me gusta. Pero necesita modificar cosas en la aplicaci칩n m칩vil. -Liberizar el uso en segundo plano de la aplicaci칩n, y as칤 poder hacer otras actividades en el m칩vil. Que sea gratuito. Por ejemplo escuchar m칰sica, mientras caminas por la Calle, es muy tedioso tener que camimar con el m칩vil en la mano, y peor si lo metes en el bolsillo con la pantalla abierta. - Un avance de v칤deo m치s detallado, y no tan brusco. En directos de m치s horas, es muy dif칤cil acertar el punto",9 de noviembre de 2022,1,0.2,9,10,noviembre,2022
Valoraci칩n: 4 estrellas de cinco,"Muy buena. No son cinco estrellas por la excesiva publicidad, cuando entras o sales de los videos, incluso dentro de los videos hay muuucha publicidad (esto ya depende del due침o del canal, claro). Se entiende que para mantener una app gratis, se necesiten auspiciantes, tampoco pasar al extremo de convertir la app en un canal de publicidad, mas que de videos. Por el resto, la verdad que muy buen trabajo.",22 de noviembre de 2022,4,0.8,22,10,noviembre,2022
Valoraci칩n: 2 estrellas de cinco,"Tengo un problema mira hace 2 meses mi barra de reproducci칩n de videos de que era de color rojo se a cambiado a color blanco, esper칠 como 2 o 3 semanas y solo se arregl칩 pero ahora de nuevo se a puesto de color blanco. Por favor podrian arreglar ese bug, desde la 칰ltima actualizaci칩n de YouTube est치 comenzando a fallar. Y por favor ya no coloquen demasiados anuncios. Gracias",20 de diciembre de 2022,2,0.4,20,11,diciembre,2022
Valoraci칩n: 3 estrellas de cinco,"No me gusta como hicieron los ajustes de la calidad de video, la opci칩n autom치tica/Calidad m치s alta, tarda bastante en reconocer la calidad WiFi como para subir el v칤deo a 1080p o m치s. Toca hacerlo manual en la mayor칤a de videos游뗷 y que decir sobre c칩mo dejaron esas opci칩n, donde hay que seleccionar m치s de lo que fue antes para llegar a esos ajustes.",27 de octubre de 2022,3,0.6,27,9,octubre,2022
Valoraci칩n: 5 estrellas de cinco,"Hola. La app es muy buen, por supuesto. Solamente me gustar칤a saber si los subt칤tulos de traducci칩n autom치tica est치n teniendo alguna especie de falla, porque, cuando yo los selecciono, en cualquier v칤deo, no aparecen, ni de espa침ol a ingl칠s, ni de ingl칠s a espa침ol, ni de los dem치s idiomas. Si a alguien m치s le pasa me gustar칤a saberlo para ser consciente de que no solo soy yo. Jsjsjs, gracias.",14 de diciembre de 2022,5,1.0,14,11,diciembre,2022
Valoraci칩n: 1 estrellas de cinco,"No puedo definir una b칰squeda de videos por fecha,salen autom치ticamente y suelen ser de meses por ejemplo 9 meses etc ,y yo busco en 24 horas,esta semana etc.Hiy volv칤 a mirar y ya estaba la opci칩n no s칠 si no la vi el otro d칤a o se a actualizado,los v칤deos muchos se ven solo pantalla negra,el audio si ,y a ocurrido otras veces ya que no veo nada .",18 de diciembre de 2022,1,0.2,18,11,diciembre,2022
Valoraci칩n: 1 estrellas de cinco,"En mi experiencia, la aplicacion es horrible para ESTUDIAR y ver videos de aprendizaje o de tutorial. A veces es necesario regresar un poco el video para ver de nuevo lo que estoy intentando aprender, y al intentar rebobinar solo unos segundos el resultado es que cambia completamente al video anterior. Lo mismo pasa cuando intentas poner pausa para ver detalladamente lo que se encuentra actualmente en pantalla, pues se pone en modo opaco y no puedo verlo. HORRIBLE para ESTUDIAR.",20 de noviembre de 2022,1,0.2,20,10,noviembre,2022
Valoraci칩n: 3 estrellas de cinco,"Hola, quer칤a avisar que en el 칰ltimo tiempo mis recomendaciones han ido yendo de mal en peor ya que me empezaron a aparecer v칤deos desagradables con contextos muy turbios que para nada me interesan, y eso que intent칠 que no me los recomendar치n pero fue imposible y tuve que habilitar el modo restringido, eso es todo el problema pero m치s all치 es una aplicaci칩n excepcional, sinceramente me sent칤 muy inc칩modo.",19 de diciembre de 2022,3,0.6,19,11,diciembre,2022
Valoraci칩n: 1 estrellas de cinco,"Qu칠 est치 pasando 칰ltimamente??? Esta saturado de anuncios, es mucho peor que antes!!! Y aparte no se si a alguien m치s le pasa pero cuando quiero ver alg칰n v칤deo la pantalla se vuelve negra y no puedo ver nada, el sonido sigue pero no se ve nada m치s que la pantalla negra, arreglen eso. Sinceramente ha bajado bastante la calidad, es deplorable en su totalidad",17 de diciembre de 2022,1,0.2,17,11,diciembre,2022
Valoraci칩n: 2 estrellas de cinco,"En las 칰ltimas 2 actualizaciones, el bot칩n de like en la pantalla completa s칩lo aparece como un circulo, no est치 el pulgar arriba y al presionar no hay ninguna animaci칩n pero si responde y lo cuenta como que presione un like. Ya van d칤as o meses que no aparecen publicaciones en mi Feed de Suscripci칩nes, por m치s que elija ver en mi Feed ver v칤deos y publicaciones estas no aparecen, tengo que seleccionar el apartado de Publicaciones para ver todo lo que han publicado los canales.",15 de diciembre de 2022,2,0.4,15,11,diciembre,2022
Valoraci칩n: 3 estrellas de cinco,"Casi todo bien hasta el cambio de los anuncios que duran 10 o hasta 30 segundos y no se pueden pasar, encima te viene un segundo anuncio que tampoco puedes pasar, y que la publicidad sea tan invasiva mostrando algo asi como ventanas emergentes, un monton de imagenes, links y cosas que tapan la pantalla en lugar de un anuncio normal",16 de diciembre de 2022,3,0.6,16,11,diciembre,2022
Valoraci칩n: 1 estrellas de cinco,"Llevo varios meses con este problema donde los short se empiezan a ver como si estuvieran corrompidos, con gliches y dem치s luego de haber bajado un poco y es demasiado molesto. Igual con los v칤deos regulares, solo que estos tambi칠n se mezclan con los anuncios y la pantalla queda parpadeando y glicheada. La unica forma de resolver todo esto es cerrando la app y volver a abrirla pero es un horror insoportable, as칤 como la exagerada cantidad de anuncios y los bots en toda la plataforma.",9 de noviembre de 2022,1,0.2,9,10,noviembre,2022
Valoraci칩n: 1 estrellas de cinco,Cada vez peor. No hay v칤deo sin antes comerse dos anuncios. Durante el v칤deo m칤nimo otros dos y al final que no falten otros dos. Incluso estando en una playlist todos los videos llevan sus anuncios. Antes el anuncio era cada x videos pero ahora incluso si cambio de v칤deo al minuto me tengo que comer otro anuncio que ya ni se puede saltar. Se te quitan las ganas de ver nada si est치s m치s tiempo viendo publicidad que lo que quer칤as ver. Cada vez peor la aplicaci칩n y cada vez tiene peores rese침as.,1 de diciembre de 2022,1,0.2,1,11,diciembre,2022
Valoraci칩n: 1 estrellas de cinco,"No solo es la lentitud al cargar el video. Los malditos anuncios son excesivos, ojo, no tengo problema que los haya en v칤deos de larga duraci칩n PERO me he topado que en v칤deos que duran menos de un minuto me salen dos molestos anuncios, es incre칤ble que no puedan arreglar por lo menos eso; es muy molesto y arruina la experiencia que una vez fue buena por aquellos tiempos.",12 de diciembre de 2022,1,0.2,12,11,diciembre,2022
Valoraci칩n: 1 estrellas de cinco,"Estan perdiendo mucho y van a seguir perdiendo a칰n mas, con tanto anuncio. En un video de 25 minutos he llegado a contar hasta 6 anuncios. (Dos al principio, otros dos en mitad del video, y para finalizar otros dos mas). Realmente la aplicaci칩n es buena y me gusta....pero el bombardeo constante de tanto anuncio hace que no quieras usarla, por mi parte cada vez la uso menos porque sinceramente se me quitan las ganas de ver cualquier video. ""La insistencia y la arrogancia nunca es buena""",22 de noviembre de 2022,1,0.2,22,10,noviembre,2022
Valoraci칩n: 3 estrellas de cinco,"Por Dios, por favor pongan la opci칩n de poder adelantar, atrasar o elegir en qu칠 momento del v칤deo quieres estar en un ""short"". Es horrible tener que esperarse todo el tiempo cuando solo quieres ver algo del final o del medio de un short y te lo psas por accidente o quieres repetirlo 游땫 .... M치s aparte me empez칩 a pasar que de repente el YouTube se pone lento y se empieza a trabar antes de cerrarse (luego de esto se arregla, pero me est치 sucediendo de vez en cuando)",18 de diciembre de 2022,3,0.6,18,11,diciembre,2022
Valoraci칩n: 4 estrellas de cinco,"No se si solo es en el m칤o pero cuando busco cualquier tipo de videos en los resultados, en ciertos videos aparecen tri치ngulos negros en donde muestra la duraci칩n del v칤deo, no afectan en la calidad del v칤deo o la app pero se me hizo raro o curioso, si pudieran darme una explicaci칩n de que significan, es un error o un fallo en mi versi칩n de Youtube ya que no he visto que alguien diga algo sobre algo similar. Fuera de eso, la app sigue siendo buena",7 de noviembre de 2022,4,0.8,7,10,noviembre,2022
Valoraci칩n: 1 estrellas de cinco,"Desde la 칰ltima actualizaci칩n, la aplicaci칩n funciona como el qlo a la hora de hacer un casting. YouTube lo veo exclusivamente haciendo listas de casting y en la tele tengo un Chromecast 4k qu칠 se desconecta a cada rato a veces no alcanzo ni reproducir un solo video completo! Ya lo desconect칠! la televisi칩n tiene Roku TV integrado que apenas funciona un poco mejor pero igual se desconecta o se traba o se pierden videos de la lista de reproducci칩n! Si saben lo que hacen o est치n aprendiendo?",8 de noviembre de 2022,1,0.2,8,10,noviembre,2022
Valoraci칩n: 2 estrellas de cinco,"Nunca e tenido problemas con esta app pero estos 칰ltimos meses e notado que los anuncios aparecen muy seguido, sea al principio (que es lo normal) entre, o al final de cada video, es muy frustrante que aparezcan muy seguido 游 se que solo son algunos segundos de anuncios pero aparecen m치s de lo normal...",19 de diciembre de 2022,2,0.4,19,11,diciembre,2022
Valoraci칩n: 2 estrellas de cinco,"El desempe침o de la aplicaci칩n est치 muy buena,fuera de errores. El problema aqu칤 son los DETESTABLES ANUNCIOS,YouTube era una plataforma de videos donde 4 de cada 10 videos aparec칤an 2 anuncios en un solo video,ahora es casi en todos los v칤deos y su duraci칩n es lo peor,es un spam constante de anuncios,los dise침os de la app est치n muy bien elaborados,por otra parte me gustar칤a que arreglaran la cuesti칩n de anuncios.",8 de diciembre de 2022,2,0.4,8,11,diciembre,2022
Valoraci칩n: 1 estrellas de cinco,"Con la 칰ltima actualizaci칩n ya se cargaron la app al completo la verdad entiendo q al a침adir algo nuevo hallan un par de errores pero esto ya es de broma, cuando pinchas en el bot칩n para poner pantalla completa se te minimiza la pantalla del video por no hablar de los subtitulos q siempre te salen aunque los quites te vuelven a salir xd despu칠s en la transici칩n de pasar a pantalla completa se te queda pillado por unos segundos y muchas veces el audio se va a la 游눨 Y Mucho Mas. En Fin Incre칤ble",4 de octubre de 2022,1,0.2,4,9,octubre,2022
Valoraci칩n: 4 estrellas de cinco,"칔ltimamente he estado teniendo un problema, trata de que en un momento cualquiera, puedo estar escuchando un v칤deo, pero de la nada se le va el audio. No entiendo por que pase eso, cuando intent칠 ver si era un error normal cambi칠 de v칤deo y el primer fotograma se puso negro y a los pocos segundos apareci칩 el v칤deo pero siempre sin audio.",5 de diciembre de 2022,4,0.8,5,11,diciembre,2022
Valoraci칩n: 2 estrellas de cinco,"La aplicaci칩n funciona bien pero tiene demasiada publicidad. Hacerse premium es bastante m치s caro que la mayor칤a de plataformas de TV y adem치s, en la 칰ltima actualizaci칩n, a alguna mente privilegiada se le ha ocurrido implementar que al pulsar ""atr치s"" para salir de la app, en lugar de hacerlo directamente hace correr por la pantalla toda la lista de v칤deos hasta el principio para salir luego. A parte de que queda fatal hace m치s lento el manejo de la app.",9 de octubre de 2022,2,0.4,9,9,octubre,2022
Valoraci칩n: 1 estrellas de cinco,"Hay muchas cosas mal en concepto, como la excesiva cantidad de anuncios o la carencia de las caracter칤sticas premiun en la opci칩n gratuita. Pero escribo la rese침a porque desde hace MESES y con dos dispositivos distintos da un fallo. El fallo consiste en que a pesar de que existen, las listas de reproducci칩n no aparecen como resultado (Ni siquiera con el filtro de b칰squeda de lista de reproducci칩n). La 칰nica manera de encontrarlas es en el canal de quien la subi칩, si lo conoces.",26 de noviembre de 2022,1,0.2,26,10,noviembre,2022
Valoraci칩n: 3 estrellas de cinco,"Quiero saber qu칠 sucedi칩 con la actualizaci칩n bestial que hab칤an lanzado, con un fondo negro espectacular y de repente volvi칩 al gris insulso ese. 쯈u칠 sucede? Ser칤a excelente que vuelva esa tonalidad oscura. Tres estrellas por lo pronto, mi experiencia es muy buena en la plataforma, aunque deber칤an tambi칠n corregir algunos errores de reproducci칩n que no hace falta que se los diga ya que sus desarrolladores son muy capaces.",23 de noviembre de 2022,3,0.6,23,10,noviembre,2022
Valoraci칩n: 2 estrellas de cinco,"Es insoportable la frecuencia de publicidad, 4 spots en un v칤deo de 5 minutos? Fatal. La nueva interfaz no es muy funcional, pretenden poner muchos controles y comentarios y no los botones de navegaci칩n como principal y un buscador m치s claro de historial y listas de reproducci칩n. La opci칩n A침adir un video a las lista privadas debe mejorar mucho, las listas deben ser en orden alfab칠tico o al menos poner un campo de b칰squeda y al crear una nueva Lista no deber칤a dejar repetirse el nombre",27 de noviembre de 2022,2,0.4,27,10,noviembre,2022
