valoracion,comentario,fecha,valoracion_number,score,day,month,month_string,year
Valoraci칩n: 1 estrellas de cinco,"por favor se los pido encarecidamente saquen esta nueva version y pongan la anterior,porque ya no puedo reproducir todo el contenido de un canal de manera continua y no me da opcion de ir reproduciendo todos los videos uno a uno y pierdo muchisimo tiempo asi,quiero que sea como antes,que todos los canales tengan la opcion de reproducir todos sus videos recientes de manera continua como una lista de reproduccion,alguien me podria ayudar como se hace eso con esta nueva version en la compu?",1 de noviembre de 2022,1,0.2,1,10,noviembre,2022
Valoraci칩n: 2 estrellas de cinco,"La cantidad de anuncios es sobre exagerada, pongo un v칤deo, 춰PUM! anuncio, en ocasiones colocan 2 anuncios de los que no se pueden saltar, es lo 칰nico malo, de ah칤 en fuera est치 bien, pero la cantidad exagerada de anuncios arruina completamente la experiencia",19 de octubre de 2022,2,0.4,19,9,octubre,2022
Valoraci칩n: 1 estrellas de cinco,"Que rayos est치 actualizando no me gusta para nada , si de por si antes av칤a anuncios ahora hay muchos m치s , cada que bajo dos videos hay un anuncio , y no encuentro como regresarlo a como se veia antes , aparte que en principal me aparecen videos que antes de la actualizaci칩n ni siquiera me recomendaba ni por asomo YouTube, el algoritmo ya savia lo que me gustaba y quer칤a ver , y ahora me aparecen tonter칤as como una se침ora enbarazada comprando o f칰tbol 춰YO ODIO EL F칔TBOL! QUE LO RECOMIENDAN !",29 de octubre de 2022,1,0.2,29,9,octubre,2022
Valoraci칩n: 1 estrellas de cinco,"Desde hace un tiempo los videos en HDR se ven palidos y curiosamente solo se ven bien cuando la pantalla gira para ponerse en pantalla completa durante un instante, pero vuelven a verse opacos al instante. No tiene pinta de que vayan a solucionar el problema...",31 de octubre de 2022,1,0.2,31,9,octubre,2022
Valoraci칩n: 4 estrellas de cinco,"Muy buena actualizaci칩n, se siente m치s c칩modo y m치s sutil. El 칰nico detalle es la molesta pero no tan obsesiva publicidad, no se vendan as칤 tan feo, en muchos lados del mundo es complicado comprar YouTube (aparte del costo), espero tomen en cuenta lo que dije. Amo YouTube, y escuchar m칰sica ah칤. Pdt: Me gustar칤a que permitan escuchar m칰sica en segundo plano鮫",3 de noviembre de 2022,4,0.8,3,10,noviembre,2022
Valoraci칩n: 3 estrellas de cinco,"Me encanta vuestras actualizaciones. Cada fallo quita una estrella. 1. Los anuncios: Algunos telos puedes pasar al primer segundo y otros tienes que verlos enteros(equivale a 30"") adem치s de que vienen muy amenudo. 2. Las placas(plata oro...) Mucha gente se ponen chulos al tener una placa y tambi칠n tirays el dinero. 3. Las paradas de YouTube (cuando se queda sin responder.) Puede que no sea mucho vuestra culpa (por eso no quite puntos.) Pero se puede sospechar algo. (Y que videos den miedo)",6 de noviembre de 2022,3,0.6,6,10,noviembre,2022
Valoraci칩n: 1 estrellas de cinco,"Ver muchos anuncios en s칤 no es malo, lo tolero, pero est치 funcionando horrible la aplicaci칩n. Lo digo porque los anuncios aparecen pero no se reproducen, manualmente debo darles play e incluso as칤 no funcionan. Sucede tanto que ya nisiquiera uso la app porque s칠 que no voy a poder ver los videos porque un anuncio se va a bugear. P칠simo",17 de noviembre de 2022,1,0.2,17,10,noviembre,2022
Valoraci칩n: 1 estrellas de cinco,"쯈u칠 est치 pasando con el Historial? Cada vez m치s seguido permite retroceder hasta cierto punto (no m치s all치 de un d칤a) y luego se detiene, para recuperarse cuando le da la gana porque ning칰n truco cl치sico funciona. Es realmente limitante.",11 de octubre de 2022,1,0.2,11,9,octubre,2022
Valoraci칩n: 3 estrellas de cinco,"Una aplicaci칩n la cu치l no uso tanto 칰ltimamente tengo algunas quejas hac칤a la aplicaci칩n ya que 칰ltimamente se est치 volviendo muy molesto los anuncios ya que estos pueden aparecer en cualquier momento y lo peor es cuando aparecen 2 o 3,lo dem치s es que de la nada no te deja poner en otra posici칩n la c치mara y eso me molesta mucho ya que tengo que ver el v칤deo de forma inc칩moda y estoy segura que a muchas m치s personas le sucede lo mismo y eso lo vengo a declarar para que puedan arreglar eso fin 游눓",24 de octubre de 2022,3,0.6,24,9,octubre,2022
Valoraci칩n: 1 estrellas de cinco,"Hace unos d칤as vengo con problemas con la app, no me muestra los videos, se queda la pantalla negra cargando o directamente me dice que no hay internet (cuando si hay), ya la desinstale, la actualice y cada d칤a est치 peor, tambi칠n tiene el problema que no te deja presionar para salir de pantalla completa o girar la pantalla, toca buscar la manera de bajar el men칰 o bloquear y desbloquear el celu para poder salir, los anuncios, antes eran menos molestos, ahora se pasan, van uno detras de otro.",1 de noviembre de 2022,1,0.2,1,10,noviembre,2022
Valoraci칩n: 2 estrellas de cinco,"Disconforme con la aplicaci칩n, me pas칠 al plan premium y ahora me dificulta ver los videos ya que no se reproducen. Tengo que cerrar la app y volver a abrirla porque se ""tilda"" tengo muy buena conexi칩n a internet y memoria disponible en el dispositivo. Muy mal servicio",14 de octubre de 2022,2,0.4,14,9,octubre,2022
Valoraci칩n: 1 estrellas de cinco,"Tiene que pasar menos anuncios por qu칠 es cansador... El otro problema es cuando se ven videos en forma horizontal, luego se sale para atr치s y se pone en forma vertical y eso es muy fastidioso... As칤 que mano a la obra y soluciones esos dos problemas CUANTO ANTES....",18 de noviembre de 2022,1,0.2,18,10,noviembre,2022
Valoraci칩n: 2 estrellas de cinco,Se produce a cada rato un error de pantalla y seguramente por tantan publicidad la cual meten en un video que al ni le pagan por eso y ni se si voy a querer mirarlo todav칤a pero de inmediato hay un comercial al entrar . La calidad de imagen que siempre deja la peor en autom치tico. Todo esto solo para que a fuerza contrates una suscripci칩n de paga que no aporta y solo desbloquea las cosas que antes pod칤a hacer el Youtube originalmente.,17 de noviembre de 2022,2,0.4,17,10,noviembre,2022
Valoraci칩n: 2 estrellas de cinco,"Excelente plataforma con excesiva publicidad en la versi칩n libre, incluso arruinando el mismo material audio visual que propone. Una l치stima esta propuesta cada vez m치s lucrativa a costa de cualquier recurso. Esperando que aparezca alyuna competencia alternativa que permita la toma de conciencia de las necesidades del usuario. Pablo.",19 de noviembre de 2022,2,0.4,19,10,noviembre,2022
Valoraci칩n: 1 estrellas de cinco,"De mal est치 en peor, YOUTUBE ya no es lo que fue, est치s mirando un v칤deo y te tira un anuncio cada 2 minutos, inclusive si est치s viendo un video te tiran en total hasta 10 o m치s anuncios , los quitas y te ponen otro, y otro seguidos. no te dejan ver en paz nada, esto para que contrates su YOUTUBE PREMIUM, pr치cticamente si no pagas te est치n molestando a cada rato mientras vez videos, cr칠anme que nadamas porque no hay otra plataforma similar, de lo contrario yo ya me hubiese cambiado. Es una burla",17 de octubre de 2022,1,0.2,17,9,octubre,2022
Valoraci칩n: 1 estrellas de cinco,"Antes era demasiado bueno pero ahora es como una basura ya que se traba demasiado no puedo ver un video sin que se trabe(no es porque no tenga Internet) y se tildan y me dice que no responde youtube y esto sucede casi todo el tiempo. Me gustaba m치s la actualizaci칩n de antes era mejor y los anuncios tenes que ver 2 anuncios si o si o si no, no ves nada. Es muy molesto. Por favor arreglen esto",8 de octubre de 2022,1,0.2,8,9,octubre,2022
Valoraci칩n: 1 estrellas de cinco,"La aplicaci칩n est치 bien, pero los anuncios son muy molestos, ahora salen cada 4 minutos, tambi칠n si regresas el video unos cuantos minutos meten otro comercial (cuando no met칤an publicidad en una parte que ya viste), incluso dejando pausado el video despu칠s de un anuncio me sucede que al darle play me vuelve a salir otro anuncio. Adem치s la publicidad ni enfocada est치, s칩lo salen comerciales de Uber, Didi y Rappi con informaci칩n irrelevante, cada vez es peor la experiencia por esto.",9 de noviembre de 2022,1,0.2,9,10,noviembre,2022
Valoraci칩n: 2 estrellas de cinco,"Este comentario no tiene nada que ver con la aplicaci칩n de Android, sino con la aplicaci칩n en los Smart TV, no s칠 que has hecho con el audio de los v칤deos musicales que se escucha deficiente a nivel de vol칰men y con calidad baja de audio en los televisores... Espero que corrijas estos problemas.",20 de octubre de 2022,2,0.4,20,9,octubre,2022
Valoraci칩n: 1 estrellas de cinco,"Desde la 칰ltima actualizaci칩n las publicidades me pausan el video a cada rato y muchas veces falla. Entonces tengo que salir y entrar varias veces para continuar viendo el v칤deo. P칠sima experiencia, no se pueden seguir viendo videos de esta forma.",16 de noviembre de 2022,1,0.2,16,10,noviembre,2022
Valoraci칩n: 1 estrellas de cinco,"Cada vez lo empeoran m치s con cada actualizaci칩n, parece que est치n deseando que todo el mundo deje de usar YouTube. No paran de cambiar las cosas que ya estaban bien haci칠ndolas menos intuitivas y cada vez m치s b치sica la interfaz (cuando estas viendo un v칤deo ni siquiera parece que sea YouTube), quitan cosas 칰tiles que a los usuarios nos gustaban y queremos que vuelvan y en lugar de darnos lo que queremos a침aden cosas que literalmente nadie ha pedido ni sirven para nada. Y ya ni hablar de las ads.",1 de noviembre de 2022,1,0.2,1,10,noviembre,2022
Valoraci칩n: 1 estrellas de cinco,"Solo puedo decir que es mal칤simo interrumpir un v칤deo cada 1 minuto con anuncios que duran 5 minutos y para ser poco 2 anuncios est치 muy mala la aplicaci칩n horrible no se puede disfrutar ni de una m칰sica ni de ning칰n aprendizaje por qu칠 tienen muchas interrupciones es un asco la aplicaci칩n cada d칤a empeora, peor a칰n porque se corta a media pantalla mientras sigue el v칤deo con la publicidad queda colgada la publicidad a media pantalla junto con el v칤deo que se est치 mirando",27 de octubre de 2022,1,0.2,27,9,octubre,2022
Valoraci칩n: 1 estrellas de cinco,"Falla nueva Al bajar de costado las opciones de celular, por ejemplo en pantalla completa un v칤deo y querer configurar el brillo o captura de pantalla no permite ver nada de las opciones. Loco, cuando busco informaci칩n sobre tiburones beb칠s no quiero los ptos canales infantiles y sus canciones, manden eso a Youtube kids de una vez",23 de octubre de 2022,1,0.2,23,9,octubre,2022
Valoraci칩n: 3 estrellas de cinco,"Excelente aplicaci칩n pero desde hoy no me salen videos , solo publicaciones. Puedo pasar horas bajando y no salen videos. Solo publicaciones , cabe mencionar que no ha habido ning칰n cambio en mi dispositivo ni nada fuera de lo com칰n. Espero que me den una respuesta por que la verdad es bastante molesto , y he buscado opiniones externas y no he visto a nadie con un problema parecido. No se como arreglarlo , entre a play store y le d칤 a "" actualizar "" pero sigue igual. Respondame please.",3 de noviembre de 2022,3,0.6,3,10,noviembre,2022
Valoraci칩n: 1 estrellas de cinco,"칔ltimamente est치 yendo muy mal. He tenido un problema en los 칰ltimos d칤as, a veces se pone la pantalla en negro y tengo que reiniciar el v칤deo o aplicaci칩n y tambi칠n que solo hay hasta 480p cuando el v칤deo es de mayor calidad pero la aplicaci칩n solo me permite hasta 480p, solucionen eso ya.",30 de octubre de 2022,1,0.2,30,9,octubre,2022
Valoraci칩n: 1 estrellas de cinco,"La cantidad de anuncios es abusiva. Impiden que puedas reproducir los videos, ya que al momento de agarrar el hilo ponen dos publicidades juntas, sin pasar 10 minutos nuevamente publicidades. Te quitan las ganas de ver cualquier v칤deo. Su uso pronto va a desaparecer de todos mis dispositivos",18 de noviembre de 2022,1,0.2,18,10,noviembre,2022
Valoraci칩n: 1 estrellas de cinco,"Lo que m치s odio es que haya anuncios que no se pueden saltar, siempre hay anuncios del tipo ""el v칤deo se reproducir치 despu칠s del anuncio"" 游뱗游뱗游뱗游뱗 Madre, yo no estoy en YouTube para ver anuncios, estoy ah칤 para ver los v칤deos de los canales, as칤 que s칤 pudieran quitar ese tipo de anuncios. Les estar칠 agradecido.",2 de noviembre de 2022,1,0.2,2,10,noviembre,2022
Valoraci칩n: 4 estrellas de cinco,"Bueno estoy viciado a la app, la que mas uso de por si. Aunque no le doy 5 porque la experiencia no es la maxima, creo es por mi celular a veces la app me tarda en abrir y al estar dentro a veces hay algo as칤 como lag al entrar a un video, a parte de los errores que suelen suceder pero luego se solucionan.",29 de septiembre de 2022,4,0.8,29,8,septiembre,2022
Valoraci칩n: 4 estrellas de cinco,Hola para m칤 YouTube es una buena aplicaci칩n todo bien pero le doy cuatro estrellas por un problema.Es de que cuando yo conecto el YouTube en el Chromecast Lo uso en el modo control de celular pero me puse a ver videos de Mr beast XD. Pero Me puse aver c칩mo 3 videos pero al final es de que se pon칤an los v칤deos solitos me sal칤a del v칤deo y me pon칤a otro y as칤 segu칤a entonces tuve que desconectarme del Chromecast para que no siguiera con ese error pero quisiera que lo arreglaran Graciasporsu ate.,31 de octubre de 2022,4,0.8,31,9,octubre,2022
Valoraci칩n: 4 estrellas de cinco,"Aver... 춰LA PEOR ACTUALIZACION DEL MUNDO!!! YA vuelven a poner los antiguos controles por que es una porqueria... si me escucharon bien 춰춰춰ES UNA PORQUERIA!!! Y otra queja mas, en mi tablet siempre que quiero abrir la app me dice que no responde y me toca densistalarla y volverla a instalar",24 de octubre de 2022,4,0.8,24,9,octubre,2022
Valoraci칩n: 1 estrellas de cinco,"Me pregunto 쮸 quien diablos se le ocurri칩 que deber칤a haber una interfaz enorme en pantalla completa? Y peor a칰n, 쯇or qu칠 diablos no se puede quitar ahora? Es sumamente molesto ya que no se ve a plenitud el contenido del v칤deo, sino que, en cambio, debo estar viendo esa interfaz semitransparente que es innecesaria, entiendo que ten칤a funci칩n cuando se tocaba la pantalla, ahora est치 permanentemente estorbando en toda la pantalla, y espero que se solucione... Y ojal치 no sea solo para ""Premium""",30 de octubre de 2022,1,0.2,30,9,octubre,2022
Valoraci칩n: 1 estrellas de cinco,"Carga los anuncios hasta con la mejor calidad posible y sin problema, pero el v칤deo que realmente quiero ver ni lo puedo ver, se queda solamente el bot칩n reproducir sin hacer absolutamente nada. Cada vez m치s degradante esta aplicaci칩n.",16 de noviembre de 2022,1,0.2,16,10,noviembre,2022
Valoraci칩n: 3 estrellas de cinco,"Me gusta esta aplicaci칩n por su gran variedad de v칤deos, pero 칰ltimamente est치n poniendo muchas propagandas en cada video, sobre todo en los musicales, comprendo que es parte de sus necesidades, pero cortan a veces en lo m치s interesante del programa.",7 de noviembre de 2022,3,0.6,7,10,noviembre,2022
Valoraci칩n: 1 estrellas de cinco,"Saturaci칩n de anuncios, bugs etc. La peor experiencia posible. Peor a que te agreguen anuncios que no se pueden saltar esta que por culpa de ese anuncio tengas que volver a abrir la app o mejor ahun, que al ver un video del que no recuerdes el titulo pero que te llam칩 la atenci칩n tengas que perder ya que estan tan bug los anuncios que tienes que reiniciar el video (quitarlo si o si) habiendore tragado los mugres anuncios. Invito cordialmente a todos a Snaptube, esta ultima es mejor 500% GRACIAS.",16 de noviembre de 2022,1,0.2,16,10,noviembre,2022
Valoraci칩n: 1 estrellas de cinco,"Asco de app, veo m치s anuncios que videos y encima cada dos por tres hay problemas. El problema de ahora es que no me carga ningun video mientras que netflix 1080, chrome va rapido, descargas rapidas. Por favor que alguien cree una app que les de en los morros a estos 치varos.",17 de noviembre de 2022,1,0.2,17,10,noviembre,2022
Valoraci칩n: 1 estrellas de cinco,"P칠sima app. Al principio todo estaba bien los anuncios moderados y todo eso, pero ahora se a convertido en una m치quina de spam con solo poner un video te ponen 2 anuncios y si quitas y vuelves a poner te los siguen poniendo, y luego de eso en el video encuentras como 40 anuncios m치s, Y encima los videos cuando llevas un gran rato vi칠ndolos se empiezan a trabar cosa que antes no pasaba.",3 de octubre de 2022,1,0.2,3,9,octubre,2022
Valoraci칩n: 1 estrellas de cinco,"Deber칤an quitar el pausar los videos porque seg칰n no detectan actividad en la aplicaci칩n. No puedo estarles diciendo que s칤 quiero continuar la reproducci칩n cuando estoy poniendo un v칤deo que dura m치s de 4 horas porque, precisamente, quiero que dure la reproducci칩n m치s de 4 horas. No me parece que valga la pena seguir pagando porque est칠n pausando videos sin autorizaci칩n.",7 de noviembre de 2022,1,0.2,7,10,noviembre,2022
Valoraci칩n: 1 estrellas de cinco,"El bot칩n de ""no volver a mostrar"" no sirve, ni el de ""no recomendar canal"". Recomienda una y otra vez los mismos videos que todo el mundo vi칩 (yo incluido). No tiene un filtro de idioma, para que solo recomiende canales en un idioma cuando lo active.",23 de octubre de 2022,1,0.2,23,9,octubre,2022
Valoraci칩n: 2 estrellas de cinco,"Desde la 칰ltima actualizaci칩n el algoritmo de yt shorts es nefasto, es como si se hubiese reiniciado, no me aparece nada de contenido que usualmente consumo. Fallo al momento de minimizar un v칤deo, se queda a mitad de la pantalla siendo un poco molesto",1 de noviembre de 2022,2,0.4,1,10,noviembre,2022
Valoraci칩n: 1 estrellas de cinco,"La aplicaci칩n se traba antes,durante o despues de los anuncios Y no pudes reproducir el video despu칠s Necesitas cerrar el video y volverlo a poner Espero que lo arreglen pronto pues ya lleva un rato 칠se problema y es muy molesto Y es error de la aplicaci칩n. Por que ocurre en mis 2 dispositivos",16 de noviembre de 2022,1,0.2,16,10,noviembre,2022
Valoraci칩n: 1 estrellas de cinco,"Os lo digo en serio, esta es la peor aplicaci칩n que existe. Me explico: la publicidad es excesivamente ub칠rrima puesto que no dejan de salir anuncios. Es altamente imposible que una persona est칠 c칩moda con la nueva interfaz. Y por si fuera poco, ni siquiera se pueden saltar los anuncios. Adem치s de que ahora ponen 2 en lugar de 1. Si esto no se soluciona r치pido me ver칠 obligado a tomar medidas legales. Medidas inconmesurablemente nocivas para la compa침칤a. Elegid: el p칰blico o la toxicidad.",23 de octubre de 2022,1,0.2,23,9,octubre,2022
Valoraci칩n: 1 estrellas de cinco,"Horrible actualizaci칩n de Youtube sacaron el bot칩n de play/pausa, adelanto y retroceso, el de giro, adem치s lo m치s feo que la funci칩n que dejaron para deslizar hacia arriba para ver otras sugerencias de videos pone opacos los v칤deos cuando uno los est치 viendo, arreglen eso que ni ganas de usar as칤 la aplicaci칩n.",2 de octubre de 2022,1,0.2,2,9,octubre,2022
Valoraci칩n: 2 estrellas de cinco,"Esta app me funciona super mal, desde las actualizaciones los videos me funcionan muy mal, se traban todo el tiempo y tengo que hacer malabares para arreglarlo, yo utilizo una tablet Alcatel y la verdad es que no puedo entender porque no me funciona, directamente hoy, cuando iba a usar la app, no deja que la abra y se queda trabada la aplicaci칩n. Me da mucha impotencia que a pesar de TENER INTERNET me anda horrible y a veces no puedo ver videos tranquilamente. Espero que la arreglen pronto",28 de octubre de 2022,2,0.4,28,9,octubre,2022
Valoraci칩n: 1 estrellas de cinco,"Es espantosa. Aunque encuentro videos que me gustan, y tengo la app instalada en el televisor, muchas veces es una tortura. Mi wifi es el mejor, la se침al est치 perfecta, pero se pausa constantemente. Me enoja mucho no poder ver tranquila lo que quiero.",21 de octubre de 2022,1,0.2,21,9,octubre,2022
Valoraci칩n: 3 estrellas de cinco,"Me ten칤a que venir a quejar al menos de algo, el nuevo dise침o de enserrar los t칤tulos y eso en un rect치ngulo como curvedo se ve muy feo 游븷 tambi칠n el echo de que los botones de pausa adelantar y atrasar est치n muy peque침os, y cuabdo te metes a una canal ya no sale la opci칩n de m치s antiguas para ver pues sus videos m치s antiguos 游땰, eso molesta un poco ya que ah칤 que estar bajando y bajando. Tom칠 me en cuenta se que no soy la 칰nica pero da un poquito de flojera. Espero que me tomen en cuenta, bai游뗵",26 de octubre de 2022,3,0.6,26,9,octubre,2022
Valoraci칩n: 3 estrellas de cinco,"Cada ves la aplicaci칩n va peor, antes hiba muy bien nunca se tranca va pero 칰ltimamente va muy mal y definitivamente no es mi celular o Internet la raz칩n porque la e probado desde 4 celulares y Internet distintos y sigue funcionando mal arreglen eso de alg칰n manera y tambi칠n es molesto cuando cambio de v칤deo y ponen 2 anuncios sin poder saltar, si estoy viendo un v칤deo y cambio a ver otro t칠rmino viendo m치s anuncios que el propio v칤deo.",2 de noviembre de 2022,3,0.6,2,10,noviembre,2022
Valoraci칩n: 1 estrellas de cinco,"La verdad solo le doy una estrella, la aplicaci칩n en si no sirve por que al momento de reproducir un v칤deo se para tienes que esperar a que vuelva a reproducir y asi sucesivamente la verdad ni la hubiesa actualizado estaba mejor la versi칩n anterior porque ahora ni puedo ver nada espero y corrijan pronto 칠se error.Es deseperante la verda por que uno no puede ver nada .",19 de noviembre de 2022,1,0.2,19,10,noviembre,2022
Valoraci칩n: 1 estrellas de cinco,"De todas las versiones que hemos tenido de YouTube, est치 es la peor, no solo porque sacaron muchas funciones sino que tambi칠n, cuando pasa un anuncio a la mitad de un v칤deo se tilda en el anuncio y ten칠s que empezar a ver todo desde cero. UN DESASTRE.",15 de noviembre de 2022,1,0.2,15,10,noviembre,2022
Valoraci칩n: 4 estrellas de cinco,"Youtube, acabo de ver la nueva interfaz. En mi opini칩n no est치 mal, debo aceptar que es muy bonito y de seguro ha de ser muy funcional, pero hay algo un poco extra침o. Quiz치s es, no solo ver lo nuevo, sino que ten칤as una identidad en tu interfaz que con esta (la nueva) no veo. 춰De igual, excelente trabajo!.游녨",1 de noviembre de 2022,4,0.8,1,10,noviembre,2022
Valoraci칩n: 1 estrellas de cinco,"Le doy una estrella porque la verdad hoy acabo de terminar un video y me aparece un error en querer subirlo,siempre se repite en cargar,antes estaba por 97 % pero luego volvi칩 a 20 %,no es que tenga mal del internet,si no que no me gusta,varias veces estoy eliminando el video y vuelvo a subirlo pero otra ves se repite,por favor almenos arreglen eso",18 de noviembre de 2022,1,0.2,18,10,noviembre,2022
Valoraci칩n: 3 estrellas de cinco,"Est치n d치ndole m치s protagonismo a la gesti칩n de los videos de canales y para la gente que quiere encontrar el v칤deo que le gust칩 pero no lo encuentra entre ese cuchitril de lista, me gustar칤a que en la pr칩xima actualizaci칩n (a ver si no le quitan la capacidad de ordenar videos) secciones de videos que tienen un like del usuario shorts, videos y vivos",7 de noviembre de 2022,3,0.6,7,10,noviembre,2022
Valoraci칩n: 1 estrellas de cinco,"Est치 aplicacion es regular y voy a decir por qu칠, los v칤deos es como si te los estubieran cobrando por qu칠 cada v칤deo que pongo salen dos anuncios es algo molesto, tambi칠n cuando el v칤deo est치 en reproducci칩n salen 1 o asta 2 anuncios tambi칠n es molesto por qu칠 no dejan ver los v칤deos agusto y e interrumpen, la verdad est치 mal eso por qu칠 varias personas si se han quejado de eso y se molestan y comentan malo de esta aplicaci칩n arreglen eso por favor.....",29 de octubre de 2022,1,0.2,29,9,octubre,2022
Valoraci칩n: 1 estrellas de cinco,"Tengo un s21 ultra y desde hace un tiempo se auto selecciona calidad media aunque est칠 con WiFi o conectado por 4g+ y eso no es la ultima despu칠s de actualizar ahora de repente en un tel칠fono de gama alta le da por congelarse y cerrar la aplicaci칩n de vez en cuando como puede ser tan ruinosa la aplicaci칩n ? Encima plagada de publicidad, entiendo que la gente est칠 comenzando a irse",8 de noviembre de 2022,1,0.2,8,10,noviembre,2022
Valoraci칩n: 5 estrellas de cinco,"Es muy buena la aplicaci칩n por que te entretiene y puedes mucha cantidad de videos lo 칰nico malo es que aparecen muchos anuncios es que cada ves que pongo un video me aparece un anuncio, a mitad de video un anuncio, y casi al final un anuncio y eso para m칤 es un poco malo por que no deja disfrutar bien los videos por que aparecen anuncios",6 de noviembre de 2022,5,1.0,6,10,noviembre,2022
Valoraci칩n: 1 estrellas de cinco,"La app esta bien en general pero tengo una par de problemas, cuando pongo los v칤deos en 740p YouTube me los baja a 480p y es irritante eso y cuando estoy viendo un video sale un anuncio espero para saltarlo y el anuncio de queda pegado y no puedo quitarlo tengo que cerrar el video completamente y volverlo a abrir para que me ande normal y es con todos los videos",15 de noviembre de 2022,1,0.2,15,10,noviembre,2022
Valoraci칩n: 1 estrellas de cinco,"Tengo YouTube premium, Chromecast de tercera generaci칩n y un ancho de banda de 60mbps y de un tiempo a la fecha la proyecci칩n a Chromecast es de muy mala calidad, como si tuviera ancho de banda de 1mbps y resoluci칩n de 480p, la aplicaci칩n ya no permite configurar la calidad a 1080p y Home no mejora al ponerlo a 50Hz.",21 de noviembre de 2022,1,0.2,21,10,noviembre,2022
