valoracion,comentario,fecha,valoracion_number,score,day,month,month_string,year
Valoraci칩n: 3 estrellas de cinco,"Hay muchos v칤deos interesantes o/y bonitos. Ser칤a genial que se vigilaran m치s cuidadosamente los que no respetan los derechos de autor, 游뱄 modificando letras de canciones o incluso suplantando voces y textos,游닉 tambi칠n modificando im치genes. Las im치genes de contenido violento o zafio 游 no solo deber칤an canalizarse de otro modo para proteger los derechos de los menores de edad. Hasta hace pocos a침os todo esto se cuidaba m치s.游녨 Gracias por la atenci칩n. 游뗵",14 de octubre de 2022,3,0.6,14,9,octubre,2022
Valoraci칩n: 3 estrellas de cinco,"Es una muy buena aplicaci칩n para perder el tiempo cuando est치s aburrido, buen audio, buena calidad pero el 칰nico problema que tengo es que cuando salgo de la aplicaci칩n o pongo otro video, la calidad se baja a 480p. Y despu칠s no puedo subirla",1 de noviembre de 2022,3,0.6,1,10,noviembre,2022
Valoraci칩n: 3 estrellas de cinco,"Vengo otra vez a quejarme de un error, cuando quiero ver un video en espec칤ficose queda el video en pantalla color negro y no deja ver el video agusto, por favor arreglen ese error cuanto antes ya que tambi칠n hay otras personas que tienen el mismo error. Gracias",20 de noviembre de 2022,3,0.6,20,10,noviembre,2022
Valoraci칩n: 1 estrellas de cinco,"2 anuncios para escuchar una canci칩n, est치s con las manos ocupadas y ten칠s que mamarte una propaganda de 5 minutos, cuando la uso en el Smart dice omitir propaganda en 5 segundos y la propaganda siguie y sigue y nunca pod칠s omitir ya te mamaste la propaganda completa, ES LO MAS BASURA QUE HAY!!, lastima que aqu칤 este todo el contenido que uno quiere ver no hay otra opci칩n!!...si por mi fuera no le pongo una estrella le pondr칤a -5 estrellas",14 de octubre de 2022,1,0.2,14,9,octubre,2022
Valoraci칩n: 1 estrellas de cinco,"Nueva actualizaci칩n, los mismos problemas, no se pueden ver los Short, se congela la imagen, es ya algo demasiado recurrente. Parece que actualizan solo para molestar.",30 de octubre de 2022,1,0.2,30,9,octubre,2022
Valoraci칩n: 2 estrellas de cinco,"Eso de las publicidades ya es bastante molesto y estresante, cada tres minutos te tiran publicidad, me estan gastando mis megas que yo pago con publicidad que no me dan beneficios y tampoco me interesan, no se puede escuchar canciones porque te quitan la emoci칩n con tanta publicidad!",9 de noviembre de 2022,2,0.4,9,10,noviembre,2022
Valoraci칩n: 1 estrellas de cinco,"Esta bien que quieran monetizar como locos, pero parenle un poco con los anuncios, sin premium es terrible la experiencia de ver videos, mas anuncios que videos al final del d칤a, un asco 游뱍游뱙",10 de diciembre de 2022,1,0.2,10,11,diciembre,2022
Valoraci칩n: 1 estrellas de cinco,"Se fue a la 游눨, cuando selecciono 1080p se pone en 480p, lo raro es que el 480p se pone como ""resolucion maxima"", es decir no me deja subir mas, no creo que sea mi celular, es un A01, otras apps si me dan 1080p incluso el navegador...",6 de diciembre de 2022,1,0.2,6,11,diciembre,2022
Valoraci칩n: 4 estrellas de cinco,Muy buena aplicaci칩n de entretinimiento se las recomiendo y si eres alguien que quiere ver programas.ad칠mas que puedes hacer tus videos. Le doy 4 estrellas porque contiene anuncios y eso no me gusta ademas porque te aparecen cuando no te lo imaginas.,7 de noviembre de 2022,4,0.8,7,10,noviembre,2022
Valoraci칩n: 3 estrellas de cinco,"Actualmente tengo un problema que me arruina toda la experiencia y es que al entrar el la aplicaci칩n ya no me salen los v칤deos recomendados de siempre, se queda en nada y lo peor es que solo pasa cuando uso mi propia cuenta obligandome a si o si usar el buscador para ver nuevos videos de mi gusto uno por uno busc치ndolos es un problema muy molesto y que pase justo con mi cuenta donde veo mis cosas personales lo hace peor",7 de noviembre de 2022,3,0.6,7,10,noviembre,2022
Valoraci칩n: 1 estrellas de cinco,"Cuando pongo un video no me deja pausar, no me deja poner las velocidades, en los videos hay un tipo de flecha y no se puede quitar para ver el video mejor, por esta el video medio oscuro y no se puede deslizar para abajo.",2 de octubre de 2022,1,0.2,2,9,octubre,2022
Valoraci칩n: 1 estrellas de cinco,"칔ltimamente la cantidad de anuncios es muy molesta, cada v칤deo que abro sale con anuncios, y eso ya llega a ser molesto, es muy 칰til la app pero ya se est치 volviendo muy aburrido eso de no poder disfrutar de los v칤deos sin que aparezcan anuncios.",20 de noviembre de 2022,1,0.2,20,10,noviembre,2022
Valoraci칩n: 2 estrellas de cinco,"Las actualizaciones en vez de mejorar la app la empeoran: La actualizaci칩n del l칤mite de 12 horas, La actualizaci칩n de que cuando est치s en una lista d reproducci칩n al tocar marcas de tiempo se salga de la lista, la de la calidad, La de shorts, etc. Todas esas cosas deber칤an eliminarlas para que la app mejore.",10 de octubre de 2022,2,0.4,10,9,octubre,2022
Valoraci칩n: 1 estrellas de cinco,"La aplicaci칩n est치 llena de anuncios, es evidente que lo hacen para que uno tenga que pagar por su versi칩n premium, pero poner anuncios en mitad de un v칤deo musical es absurdo, inclusive ya no hay control con los anuncios, y est치 desbordado de anuncios basura inclusive de estafas",15 de octubre de 2022,1,0.2,15,9,octubre,2022
Valoraci칩n: 1 estrellas de cinco,"Ser la 칰nica plataforma de videos tiene sus ventajas, como meterle forzosamente 10 anuncios para reproducir un v칤deo, y encima tienen el descaro de preguntar que te parece la experiencia con los anuncios, para despu칠s meter otros 2 anuncios forzosos.",11 de noviembre de 2022,1,0.2,11,10,noviembre,2022
Valoraci칩n: 4 estrellas de cinco,칔ltimamente se me est치n presentando muchos fallos como el que tengo actualmente que se trata de que cuando ves un video en el m칩vil no podes ver los videos que recomendados o los siguiente no aparecen!!! Por favor arreglenlo porfaaa!!!!!!que ascooooooooooooooooo,11 de octubre de 2022,4,0.8,11,9,octubre,2022
Valoraci칩n: 1 estrellas de cinco,"No es normal lo mal que funciona est치 app deben de gastar Miles de euros en programadores y son incapaz de tener su app con un 칩ptimo funcionamiento, desde errores que se traba la app a no cargar los videos y tener que cerrar y abrir la aplicaci칩n y no es de ahora lleva meses y meses, cambien su equipo de ing porque son nefastos",5 de octubre de 2022,1,0.2,5,9,octubre,2022
Valoraci칩n: 3 estrellas de cinco,"칔ltimamente problemas para reproducir, luego de 2 o 3 videos ya al intentar ver otro v칤deo no termina de reproducir hay que cerrar la app y abrir de nuevo, en serio frustrante.",18 de diciembre de 2022,3,0.6,18,11,diciembre,2022
Valoraci칩n: 1 estrellas de cinco,"Despu칠s de ver un rato ""Shorts"", la aplicaci칩n se vuelve inutilizable. Empieza a trabarse cada vez m치s con cada video que pongo.",9 de diciembre de 2022,1,0.2,9,11,diciembre,2022
Valoraci칩n: 1 estrellas de cinco,"Le doy una estrella, para darles m치s contexto lean esto: Me salt칩 un anuncio de 20 segundos y no me dej칩 omitirlo, de 15 segundos 2 anuncios tampoco, 20 segundos de 2 anuncios, tampoco, me aburr칤 es mejor Minecraft, pero dan muchos anuncios en los vidios, as칤 que por favor YA BASTA CON ESTA #$)@)_ DE ANUNCIOS, ENSERIO, CONSIGUE UNA VIDA.",11 de diciembre de 2022,1,0.2,11,11,diciembre,2022
Valoraci칩n: 1 estrellas de cinco,"Retiraron m칤 canal sin motivo aparente desde hace 1 semana, hasta d칤a de hoy No me dieron ninguna explicaci칩n en concreto de que es lo que estaba en contra de los alineamientos del servicio, por si fuera poco eliminaron m칤 subscripci칩n a varios canales que segu칤a, (esto 칰ltimo es antes de que retiraran m칤 canal)... Espero que se pongan en contacto lo m치s pronto posible.",13 de noviembre de 2022,1,0.2,13,10,noviembre,2022
Valoraci칩n: 3 estrellas de cinco,"Es muy buena pero tiene muchos anuncios, estaria bien que diera 2 cada 3 videos, pero los anuncios se repiten bastante, ademas si alguien inicia un nuevo canal casi nadie lo va a visitar, seria mejor que los canales con menos vistas y suscriptores tuvieran mas probabilidad de aparecerle a la gente",27 de octubre de 2022,3,0.6,27,9,octubre,2022
Valoraci칩n: 1 estrellas de cinco,"Basura de app, ahora ya no se puede pasar la publicidad ni una sola vez y encima aumentasteis mas las publicacidades. Por si fuera poco ahora obligais a los usuarios a descargar YouTube premium para ver videos con calidad 4k, ustedes no aprenden, si siguen asi se van a la banca rota, una estrella porque no se puede poner menos.",2 de octubre de 2022,1,0.2,2,9,octubre,2022
Valoraci칩n: 1 estrellas de cinco,"Demasiada publicidad en cada m칰sica, cada video terminado una publicidad. Entendemos q los q no podemos pagar premium tenemos q soportar la publicidad pero por lo menos h치ganlo pasando 3 m칰sicas o como antes pero no a cada momento...",18 de diciembre de 2022,1,0.2,18,11,diciembre,2022
Valoraci칩n: 2 estrellas de cinco,"Al salir de pantalla completa la app se queda en modo horizontal, aunque tenga el movil en vertical y la rotacion desactivada. Todo se ve en Horizontal, hasta los shorts...",12 de octubre de 2022,2,0.4,12,9,octubre,2022
Valoraci칩n: 1 estrellas de cinco,"Desde la 칰ltima actualizaci칩n no paran los bugs, especialmente cuando entra un anuncio. Tengo que salir del v칤deo y volver a entrar, y me como el doble de anuncios, claro.",3 de noviembre de 2022,1,0.2,3,10,noviembre,2022
Valoraci칩n: 1 estrellas de cinco,"Esta app deberia de usarse como ejemplo de ""COMO NO HACER UNA APP"" cada vez peor y peor, hasta un becario haria mejor esta app que el atajo de grandisimos inutiles que han hecho esta chapuza. Y si les ofende, que hagan un trabajo mejor, que en otro lado les despidirian por incompententes. Cada vez a peor, cada vez mas fallos y errores, cada vez mas anuncios y cada vez peor que la anterior. Habra que asumir que estan haciendo la app mal adrede, porque esta cada vez peor hecha. ESPABILEN",12 de noviembre de 2022,1,0.2,12,10,noviembre,2022
Valoraci칩n: 3 estrellas de cinco,No me gusta usar YouTube en app por los anuncios y los errores. En mi PC uso addblockers para evitar los anuncios ya que hacen super desagradable la experiencia y se me hace absurdo pagar para usar la app.,15 de diciembre de 2022,3,0.6,15,11,diciembre,2022
Valoraci칩n: 1 estrellas de cinco,"Muy mala. Cada actualizacion, mas peor. Se me traba los videos cada 1 segundo y tambien en los shorts se traba mucho, es un desastre. Porfavor paren de actualizar youtube que lo van a hacer mucho peor. Tambien hay muchos m치s errores pero hoy no los nombrare por que son muchos.",30 de septiembre de 2022,1,0.2,30,8,septiembre,2022
Valoraci칩n: 3 estrellas de cinco,En.mi opinion YouTube esta edcediendose con lo anuncios para fijarce en su version premiun donde lo unico que cambia es en los anincios si YouTube sigue con esta mala administracion YouTube caera en bancarota mi sugerencia es que dejen de poner anuncios y no sigan con YouTube premium porque para que pagar por lo mismo pero sin anuncios asi que otro consejo vuelva aser como en 2013 donde su servicio era mejor porque si siguen asi ba a caer a banca rota y no creo que quieran eso,20 de diciembre de 2022,3,0.6,20,11,diciembre,2022
Valoraci칩n: 1 estrellas de cinco,"Muy mala aplicaci칩n, cada vez mas publicidad por video, En videos de 5 minutos hasta 3 anuncios largos, es insoportable y la verdad no te quedan ganas dr volverla a usar!!",30 de noviembre de 2022,1,0.2,30,10,noviembre,2022
Valoraci칩n: 5 estrellas de cinco,Me gusta mucho la aplicaci칩n tienes una gran variedad de videos pero tengo un problema no me aparece esta opci칩n que se llama el modo ambiente por mas que busco la opci칩n no me aparece mi tel칠fono es un Samsung galaxy A10s si por favor pueden ayudar me con eso o si lo pueden arreglar,17 de diciembre de 2022,5,1.0,17,11,diciembre,2022
Valoraci칩n: 1 estrellas de cinco,"Excesivos anuncios y no se desactiva la opci칩n de subtitulado, ya lo e echo mediante la aplicaci칩n y mediante mi tel칠fono y nada. Hoy en d칤a YouTube se volvi칩 un asco!!",20 de diciembre de 2022,1,0.2,20,11,diciembre,2022
Valoraci칩n: 1 estrellas de cinco,"No se merece ni que le de una sola estrella, esta app me anda fallando desde hace 1 mes entero, ya que no me cargan los videos y la pantalla siempre queda en blanco y tengo que entrar a Play Store para actualizarla a cada rato as칤 poder ver mis videos, es lo peor porque antes YouTube me andaba de 10 y no tenia ning칰n problema con estas actualizaciones pero ahora que me anda mal no dudo ni un segundo en no darle ni si quiera una sola estrella",19 de octubre de 2022,1,0.2,19,9,octubre,2022
Valoraci칩n: 1 estrellas de cinco,춰Las pantallas finales estorban! No puede ser que a nadie le moleste que el video que est치 viendo sea cubierto faltando unos segundos para que se termine. 춰Quiero ver el video completo sin pantallas finales!,15 de diciembre de 2022,1,0.2,15,11,diciembre,2022
Valoraci칩n: 1 estrellas de cinco,"Funciona p칠simo la reproducci칩n de m칰sica en Google TV. Se queda pegada la reproducci칩n, incluso no es capaz de cargar las car치tulas de los artistas o 치lbumes, eso sin contar que la interfaz es s칰per poco intuitiva y cuesta para encontrar el listado de los artistas que uno est치 suscrito por ejemplo. Y conste que el internet no es el problema ya que en otras aplicaciones la reproducci칩n es fluida. Adem치s tengo fibra sim칠trica de 900 MB, m치s YouTube Premium.",27 de julio de 2022,1,0.2,27,6,julio,2022
Valoraci칩n: 1 estrellas de cinco,"YouTube una de mis APPs favoritas. Ojal치 llegue una manifestaci칩n colectiva contra YouTube para poder eliminar los Shorts de forma opcional, no quiero dejar de usar YouTube pero lastimosamente el funcionamiento de este apartado est치 hecho para ser adictivo a la mente. No pedimos que quiten los Shorts, 춰pongalos opcionales! En el momento que eso suceda volver치n las 5 estrellas.",2 de octubre de 2022,1,0.2,2,9,octubre,2022
Valoraci칩n: 4 estrellas de cinco,"Ya me arto un error que hace que un v칤deo se meta con otro, nos칠 si me explico me meto a un v칤deo pero el video que vi anteriormente aparece bugeado en la parte de abajo, lo peor es que es imposible no encontrarse con este error y lo encontr칠 desde como el 2021, encima debe ser tan f치cil arreglar",29 de septiembre de 2022,4,0.8,29,8,septiembre,2022
Valoraci칩n: 2 estrellas de cinco,La app esta muy buena para ver todo tipo de videos. Pero los anuncios esta cada vez mas peor. Me esta apareciendo 1 anuncio cada 1 minuto. Arreglen esto游땨 por eso le doy 2 esrrellas. Los anuncios son muy molestos,7 de noviembre de 2022,2,0.4,7,10,noviembre,2022
Valoraci칩n: 1 estrellas de cinco,"Esta aplicaci칩n realmente que no lo vale ya ni se esfuerzen en actualizarla simplemente est치n arruinando MAS algo que hace m치s de una decada ERA hermoso ahora su agenda pol칤tica NEFASTA empez칩 a tomar el control de esta plataforma y ya todo es en base a lo que ustedes quieren... Adem치s mientras m치s """"""""""""""""""""""""""""""inovaciones"""""""""""""""""""""""""""""""" inecesarias agregan con cada actualizaci칩n m치s van arruinando esta basura y se va crasheando y cerrando m치s seguido Simplemente ME DAN ASCO TODOS USTEDES...",13 de diciembre de 2022,1,0.2,13,11,diciembre,2022
Valoraci칩n: 1 estrellas de cinco,"Hace algunos a침os se pod칤a ver contenido variado: hasta que le metieron los molestos e invasivos anuncios que aparecen a cada rato en videos de 10 minutos, por ende estoy dejando de usar esta app: ai otra alternativa new Pipe que se puede ver contenido sin esos molestos anuncios",27 de noviembre de 2022,1,0.2,27,10,noviembre,2022
Valoraci칩n: 1 estrellas de cinco,"En esta 칰ltima versi칩n y adem치s que pas칠 a YouTube Premium, el servicio est치 funcionando p칠simo, demora mucho en la carga de los videos y se detiene constantemente al reproducir videos.",1 de diciembre de 2022,1,0.2,1,11,diciembre,2022
Valoraci칩n: 1 estrellas de cinco,No se por que pero desde la ultima actualizaci칩n los v칤deos se reproducen con la pantalla en negro. Pero claro los horribles anuncios se ven impeca te juro hasta en full HD.,21 de diciembre de 2022,1,0.2,21,11,diciembre,2022
Valoraci칩n: 1 estrellas de cinco,Justo estoy viendo un video largo de YouTube y cuando aparecen dos anuncios y siempre el segundo anuncio se queda congelado que no puedo continuar de ver el video en donde quedo y tengo que cerrar la aplicaci칩n y abrirlo otra vez para continuar de ver el video y pasa mucha veces esto,16 de noviembre de 2022,1,0.2,16,10,noviembre,2022
Valoraci칩n: 1 estrellas de cinco,"묓ouTube sabe que algunas personas no tiene noci칩n del tiempo cuando entra a los Shorts 쯏 apenas entras a YouTube los ponen? Vaya que les importamos. 묈e sigue recomendando los canales y clase de v칤deos que dije que ya no quiero ver. 묇o mismo de siempre, los anuncios tan excesivos que un v칤deo dura menos que un anuncio. 묌uitaron opciones 칰tiles como la de traducir comentarios. Esperemos que alg칰n d칤a haya una variante para reemplazarlo, porque de cierta manera es obligatorio tenerla.",7 de noviembre de 2022,1,0.2,7,10,noviembre,2022
Valoraci칩n: 1 estrellas de cinco,"Me parece una buena aplicacion,pero lo malo es que hay muchos anuncios y porfavor quiten eso que es muy fastidioso y que cuento de pagar un un youtube priv solamente para tener 1 mes gratis sin anuncios dejen la bobada y sean serios,yo soy pobre pero me doy mis comodidads y me parece una mala idea pagar por un mismo youtube pero solamente por tener 1 mes sin anuncios y caro que sale esa monda,gracias si llegan a leer esto y porfavor no ofendo a nadie solo doy mi humilde opinion.",9 de noviembre de 2022,1,0.2,9,10,noviembre,2022
Valoraci칩n: 1 estrellas de cinco,"No se si sea mi celular o sea la aplicaci칩n pero no me permite ver los videos en modo horizontal y es bastante molesto, antes de que se actualizar치 si deje ver los videos de forma horizontal. Espero resuelvan este problema.",28 de octubre de 2022,1,0.2,28,9,octubre,2022
Valoraci칩n: 1 estrellas de cinco,"La nueva interfaz es un asco, quiero ver videos de un stream de hace 5-6 meses, y al momento de buscarlos, no me aparecen en la lista de los videos subidos de la persona arreglen eso, porque es una porquer칤a su nueva interfaz",1 de noviembre de 2022,1,0.2,1,10,noviembre,2022
Valoraci칩n: 2 estrellas de cinco,Pens칠 que con la inscripci칩n a YouTube premium podia descargar los v칤deos y m칰sica en mi tel칠fono. Solo queda descargado en la aplicaci칩n y no lo puedes compartir como un v칤deo normal si no como link. Deber칤an de permitir la descarga del v칤deo.,8 de noviembre de 2022,2,0.4,8,10,noviembre,2022
Valoraci칩n: 2 estrellas de cinco,"游먹롋丘멆잺Estoy DESEPSIONADA por completo!!! Antes a la hora de querer bajar v칤deos se pod칤a sin ning칰n problema pero ahora, tienes que pagar!! Esto es muy injusto quieren pagarte por TODO 游멇릦 se ve como ha pedido la calidad de la app y estoy en desacuerdo por qu칠 se supone que la app se creo con el fin de que las personas pudieran ver videos,pero esto !!YA NO ES JUSTO!! Pido por mi y por todas las personas que arreglen esto 丘멆잺仇껋릦",6 de diciembre de 2022,2,0.4,6,11,diciembre,2022
Valoraci칩n: 4 estrellas de cinco,"Yo sin problemas le dar칤a las 5 estrllas me encanta YouTube y me va gustando m치s y m치s cada vez van mejorando la app en la apariencia y dise침o y todas esas cosas pero hay algo que no me gusto que hicieron fue suspender el bot칩n de ""No me gusta"" estaba divertido calificar videos con dos opciones en las manos 九 游뱡 驕 pero bueno me gustar칤a que vuelvan a validar ese boton :)",29 de noviembre de 2022,4,0.8,29,10,noviembre,2022
Valoraci칩n: 5 estrellas de cinco,Para disfrutar de los mejores videos est치 aplicaci칩n es buena ero a ala hora de descargar te dice que tienes que pagar para poder hacerlo no es justo si tengo a침o utilizando la aplicaci칩n y no pueda disfrutar de tan buen recurso**** abre otra forma de poder descargar sin que le complique la existencia a uno si por favor alguien sabe como hacer se lo agradecer칤a...est치 app a tenido muchos &&&& de interacci칩n con el mundo entero y todos los idiomas y versiones posibles ... (;)(;)(;)(:)=仇벒잺仇벒잺仇벒잺仇벒잺仇벒잺仇,14 de noviembre de 2022,5,1.0,14,10,noviembre,2022
Valoraci칩n: 2 estrellas de cinco,"Ser칤a m치s eficiente si colocan la publicidad en a los lados de los v칤deos, como videos sin audio, ya que generan estr칠s, cuando estamos viendo algo y te muestran la publicidad en el mismo video",6 de noviembre de 2022,2,0.4,6,10,noviembre,2022
Valoraci칩n: 1 estrellas de cinco,80% no conecta internet a pesar de ser premiun tengo que llegar a YouTube por alguna p치gina de internet.. y comerme los anuncios... No permite eliminar aplicacion .. subt칤tulos son en el mismo idioma no permite seleccionar.. cuando entra a pesar de ser premiun pasan publicidades...,17 de octubre de 2022,1,0.2,17,9,octubre,2022
Valoraci칩n: 3 estrellas de cinco,Era una exelente opci칩n para escuchar m칰sica y ver pel칤culas y etc pero los anuncios son muy fastidiosos est치 bien que tengan anuncios pero no exajeren porfa ya 4 a 6 anuncios en un solo video son demasiados no creen solo esa qu칠ja tengo ha y no todos tenemos dinero para pagar la cantidad que piden para quitar los anuncios ya que la mayor칤a que utiliza est치 aplicaci칩n no son personas de muchos recursos como yo 游 por eso me quejo,17 de noviembre de 2022,3,0.6,17,10,noviembre,2022
Valoraci칩n: 1 estrellas de cinco,"La cantidad de comerciales es excesiva, y si se que de eso viven pero nmms, hasta 3 comerciales por video y seguidos, lo peor es que cada vez lo anunci칩s son m치s largos y sin opci칩n de saltarlos, un anuncio de 20 segundos, ni que estuviera en twitch",24 de noviembre de 2022,1,0.2,24,10,noviembre,2022
Valoraci칩n: 5 estrellas de cinco,"Soy de la vieja escuela, conoc칤 YouTube en 2007-2008 cuando ten칤a 7 u 8 a침os, era una 칠poca maravillosa libre de anuncios. Ahora es insoportable hasta tal punto de que ha cada segundo te aparezcan anuncios de m치s de 15 segundos sin poder saltarselos. Que te paso YT, antes eras ch칠vere.",13 de diciembre de 2022,5,1.0,13,11,diciembre,2022
Valoraci칩n: 4 estrellas de cinco,"Los shorts estan bien, algunas veces la app por si me pone la maxima calidad q puedo tener, pero eso me da lag por alguna raz칩n y aunque le de siempre a la segunda mejor calidad, me sigue poniendo la m치s alta, aunque debo de decir q youtube esta bien ignorando lo de la calidad.",3 de noviembre de 2022,4,0.8,3,10,noviembre,2022
Valoraci칩n: 1 estrellas de cinco,"Usa mucho esta aplicaci칩n en mi tablet y tras una 칰ltima actualizaci칩n de la aplicaci칩n, los gestos han empeorado. Los deslizamientos con un dedo van lentos y la opci칩n de imagen en imagen va poco fluido y lento",1 de octubre de 2022,1,0.2,1,9,octubre,2022
Valoraci칩n: 3 estrellas de cinco,Para que va uno a hablar lo que no es esta app es muy buena lo 칰nico que tiene malo es que solo tenga convenio con claro o tarjeta de cr칠dito para poder acceder a YouTube premium deber칤an abrir m치s opciones con otros operadores m칩viles no solo claro por ejemplo avantel Tigo movistar en mi caso personal tengo avantel y cada que abro YouTube me sale que adquiera YouTube premium pero si no hay m치s opciones para adquirirla uno como hace deber칤an abrir m치s opciones de pago,12 de noviembre de 2022,3,0.6,12,10,noviembre,2022
Valoraci칩n: 1 estrellas de cinco,La experiencia es mala ya que los anuncios salen a cada rato. No entiendo para que tienen la opci칩n de reproducci칩n autom치tica si solo carga anuncios y los v칤deos los deja pausados . Que asco de aplicaci칩n 游뱙游뱙,30 de octubre de 2022,1,0.2,30,9,octubre,2022
Valoraci칩n: 3 estrellas de cinco,"La versi칩n premium deja mucho que desear, no es tan cara, pero barata no es, le hace falta mejorar muchas cosas, como poder hacer grupos en el apartado de descargas, o mover las descargas del lugar",7 de octubre de 2022,3,0.6,7,9,octubre,2022
Valoraci칩n: 1 estrellas de cinco,"Arreglen los anuncios!!!! Aparece un anuncio durante un video y ya no se puede reproducir, tengo que cerrar y volver a abrir el video, incluso a veces el video inicia de vuelta.",16 de noviembre de 2022,1,0.2,16,10,noviembre,2022
Valoraci칩n: 1 estrellas de cinco,"aparte de un buen pu침ado de anuncios, en la app m칩vil no puedo sacar lo del bot칩n del play del centro del v칤deo, y si espero tampoco sale solo, pero bueno, ya llev치is tiempo en decadencia, normal que os de igual todo",15 de diciembre de 2022,1,0.2,15,11,diciembre,2022
Valoraci칩n: 2 estrellas de cinco,Arreglen el detalle de l miniatura en segundo plano. Por lo que veo en los comentarios no soy el 칰nico. Desde hace unas semanas cuando pones la miniatura para ver YouTube en segundo plano no se ve el video. Se queda una imagen de los likes como si se hubiera cortado mal.,7 de octubre de 2022,2,0.4,7,9,octubre,2022
Valoraci칩n: 1 estrellas de cinco,"Los videos no cargan o tardan m치s en hacerlo. Si se cuelga hay que cerrar la app y volver a entrar. Varios no cargan en la app pero s칤 en el Chrome. Las publicidades del comienzo anda y el video no se reproduce, qu칠 pasa ??? Quitaron 칤conos del men칰 cuando se reproduce a pantalla completa. Cada vez peor, si hubiera 0 estrellas se lo merecen.",15 de octubre de 2022,1,0.2,15,9,octubre,2022
